country,points,price,variety,country_from_location,keywords
0,2.135897251930969,0.8607992183165362,25,,Pinot Noir Dan Goldfield Steve Dutton ripe black cherry currant flavors firm acidity fine-grained tannins grip balance concentrated fruit flavors solid structure long life cellar Best after 2020
0,-0.833100874189365,0.5113921642831963,37,,rich crushed ripe blackberries blueberries dill black pepper dark chocolate firm tannins furry tannins bitter age
0,-0.833100874189365,-0.22236264918681736,5,,aromas vanilla wood spice elegant dried out dilute fruit flavors short finish
0,1.5420976267069022,2.3283088452565632,5,0.0,collaboration Sonoma County winemaker Jesse Katz Ken Forrester South Africa 100% varietal red robust rich dark cherry red currant integrated oak bold body
0,1.2451978140948687,0.5113921642831963,25,,rich Pinot cherry compote mocha root beer generously oaked spicy oak notes velvety texture big fruit-forward delicacy harmony best now through 2008
1,1.8389974393189357,2.677715899289903,7,,tight freshness rich fruit structure long-term development wood yellow-fruit flavors magnificent
0,0.651398188870802,-0.29224405999348535,27,,Pinot Noir dry red wine sophistication elegance soft approachable cherry fruit herbs sage thyme rich earthiness
0,-0.833100874189365,-0.6067104086234912,17,,easy drinking dinner wine dry balanced smooth tannins plum blackberry coffee flavors rich blueberry-muffin finish
2,-1.4269004994134318,-0.7115325248334932,20,,brassy hue sweet nose peach blossom melon cider soft palate punchless
3,0.651398188870802,0.37162934266986036,39,,cool on the nose tree bark tobacco aromas tannic stout roasted black-fruit flavor espresso bitterness syrupy side raw power Drink now–2018
2,1.2451978140948687,0.7909178075098682,18,,fine aromas cola red currant licorice blue flower moist earth long texture smooth silky elegant menthol finish
0,-0.23930124896529814,-0.3970661762034873,5,,dependable elegant herbaceous notes green olives sweet bell pepper oak fatness grilled red meat berry sweetness
0,0.057598563646735254,-0.29224405999348535,7,,very sweet residual sugar powerful flavors apricots honey oranges vanilla soft luscious sweetness
3,-0.833100874189365,-0.8512953464468291,20,,peachy aromas citrusy almond skins citrus pith green melon nectarine
1,0.9482980014828354,0.23186652105652442,20,1.0,Ame spirit soul Alain Rotier Gaillac estate great perfumes wood chunky black fruits soft wine concentration dense fruit tannins
0,0.9482980014828354,0.5812735750898642,5,0.0,bone dry acidity tough tannins blackberries currants cherries Yountville ageable wines resolve 2016
2,0.3544983762587686,0.02222228863652051,44,2.0,Ribolla Gialla Friulano Riesling bright golden color lively fruit aromas stone fruits passion fruits crisp lively Northeast Italy
0,-1.1300006868013983,-0.1874219437834834,45,,raw rustic briary green peppercorn mouthfeel scoury tart acids berry-cherry fruit sweet-and-sour Zinny barbecue
0,0.057598563646735254,0.5812735750898642,25,,Pinot soft lush flavor raspberries cherries red currants licorice bacon long spicy finish complexity immediate appeal drink up
0,-1.723800312025465,-0.8163546410434951,5,,heavy soft melted mocha-raspberry sundae lacks structure too sweet
0,-0.23930124896529814,0.09210369944318848,38,0.0,Birch Creek Vineyard stainless-steel-fermented aged wine custard lees herbs clover flavors richer feel concentration finish
2,-1.1300006868013983,-0.46694758701015526,32,,stewy earth oak brightness herb-infused berry tomato classic style fresh
0,0.9482980014828354,-0.11754053297681542,7,,very dry earthy dusty hay dried straw tangerine sweet lime lychee peaches and cream crisp nuanced complexity
0,-1.4269004994134318,-0.32718476539681934,27,,ungenerous unripe grapes earthy vegetal taste not going anywhere drink up
0,-0.5362010615773315,-0.6067104086234912,45,,mountain Zin briary brambly tannins peppery taste wild berries alcohol heat structure barrel softened tannins backyard barbecue red wine
1,1.5420976267069022,-0.1874219437834834,37,,Moody complex brooding superb exceptional value purple violets black forest cake cocoa nibs espresso granules dark juicy black raspberries full firmly structured pepper tea smoked meat black fruit
3,0.9482980014828354,-0.7464732302368271,27,3.0,Cab Franc Tempranillo Penedès meaty ripe round core fruit chocolaty warmth kick subtlety bargain hunter's dream
0,-0.5362010615773315,-0.6765918194301591,35,0.0,Clos du Bois Lake County Sonoma County Sauvignon Blanc dry crisp lemongrass grapefruit peach lightly oaked
0,-0.833100874189365,-0.6416511140268252,35,,oak influence smokiness lime Meyer lemon tropical fruit crisp acidity sweet-and-sour taste cocktail sipper ham Chinese food
0,0.057598563646735254,-0.6067104086234912,24,,tasty fleshy fruity flavor fresh cut pear cinnamon spice round balanced delicious residual sweetness
0,-2.0207001246374983,-0.46694758701015526,4,,aromas pie crust red fruit barnyard tart simple wine watered-down flavors red berry
0,-0.833100874189365,-0.29224405999348535,7,,bold densely structured vanilla-cream orange-soda pineapple-custard good acidity modern style ripe straightforward feel
0,0.3544983762587686,-0.5018882924134892,13,0.0,Gewurz Navarro neutral oak fermentation rich crisp spicy exotic fruit wildflower flavors
0,-1.1300006868013983,-0.7464732302368271,35,,off-dry ripe lemons limes vanilla brisk acidity pair well sweet Chinese foods Vietnamese foods price
0,-0.5362010615773315,-0.11754053297681542,25,,Pinot Noir dry elegantly constructed crisp acidity backbone of tannins raspberry cherry fruit delicious texture scoury warm low alcohol
0,0.057598563646735254,-0.46694758701015526,7,,polished sophisticated lush green apple pineapple buttered toast cinnamon balance drinkability
2,1.5420976267069022,0.057162994039854496,18,2.0,Barbaresco cherry cassis spice smoke leather tobacco approachable natural concentration bright fruit flavors acidity ten years
3,1.5420976267069022,1.280087683156544,39,,rooty earthy leather cassis tobacco dried cheese cola rich textured firm tannins friendly tannins coffee mocha roasted berry chocolaty finish drink now through 2018
2,0.9482980014828354,0.6511549858965322,18,2.0,Rabajà Barbaresco intensity sophistication aromas black fruit spice tar licorice balance acidity tannic structure pair roasted pork prunes
1,-1.723800312025465,-0.921176757253497,17,1.0,Michel Laroche Chablis chlorine notes aromas mint sweet wood power suppleness palate finish dark sharp burnt flavor
0,1.2451978140948687,1.454791210173214,5,,Reverie's Cabernets tight grapey blackberry jam stony minerality sweet tannins hard tannins cellar 6–8 years
0,-0.23930124896529814,0.057162994039854496,20,,Mourvèdre full palate varietal flavors citrus ripe tree fruits leaf forest soft overripe short finish
0,-0.23930124896529814,-0.46694758701015526,35,,bone-dry crisply acidic ultraclean Sauvignon Blanc lemongrass lime grapefruit savory bright cold streak stony minerals
2,-0.833100874189365,-0.7115325248334932,19,2.0,Nero d'Avola fruity blackberry tart red-cherry fresh acidity pizza informal meals
2,-1.1300006868013983,-0.7115325248334932,20,2.0,Riunite Albinea Canali Ottocentonero dry Lambrusco raw fruit cherry almond paste bitterness
0,-1.1300006868013983,-0.46694758701015526,35,,ripe vintage cool 2007 harvest green wine grapefruit gooseberry feline territory
0,0.3544983762587686,-0.04765912217014746,20,,aromas lemon soil flowers flavors restrained balance tannins tamed
0,-0.23930124896529814,0.057162994039854496,5,0.0,cool climate Cab wintergreen mint sweet red cherry black raspberry lightly elegant weight dry friendly with food
0,-1.4269004994134318,-0.6765918194301591,5,,ripe jammy cherry blackberry chocolate easy-drinking rusticity raisiny finish astringency tannins
3,-1.4269004994134318,-0.6416511140268252,20,,aromas milk-chocolate-covered cherries forced oak sweet candied choppy juicy red fruit flavors buttery oak finish complexity
2,-0.23930124896529814,-0.6416511140268252,32,,Sangiovese Merlot softness dimension cherry blue flowers toasted almonds exotic spice elegance compact
2,-0.5362010615773315,-0.46694758701015526,23,,Pinot Grigio aromas stone fruit melon citrus acidity structure fish pasta risotto creamy texture
0,2.135897251930969,4.075344115423262,5,0.0,tannic closed acidity richness blackberries black currants dark chocolate butterscotch sweet cinnamon spice rich decadent enjoy now gather momentum 6–8 years
3,-1.1300006868013983,-0.8512953464468291,36,,salinic aromas lime lychee smooth sweet white fruit peach semi-dry sugary
3,-0.5362010615773315,-0.6765918194301591,41,,fresh berry aromas spice notes rugged hot juicy berry flavors not overly evolved not complex tight finish aggressive spunky clean honest flavors
1,0.3544983762587686,-0.5368289978168233,2,,14 months' new wood aging wood toast weight blackberry fruits firm tannins finely structured mature well
0,-1.1300006868013983,-0.6765918194301591,22,0.0,Erath fresh lightly fruity Pinot Gris substantial soft simple wine stainless steel fermented quaffer
0,0.9482980014828354,0.09210369944318848,35,,Denis Malbec brilliantly delicious crisp dry richly textured golden honey dried apricot lychee minerally steely finish smoky oaky edges
0,0.3544983762587686,0.057162994039854496,5,,Cabernet cranberry cassis earthy cedar herbal tannins 2017-2019 air
0,-1.4269004994134318,-0.6416511140268252,7,,perfumed roasted hazelnuts fresh apples savory dry Chardonnay full bodied nut oil nut skins wood sap astringency finish
2,1.8389974393189357,1.9090203804165555,18,2.0,Brunate Barolo dense clay soils high color saturation aromatic caliber black fruit plum spice tobacco cola dark chocolate firm finely textured power dimension personality long finish
3,-1.4269004994134318,0.09210369944318848,41,,menthol licorice grilled meat molasses bright fruit marinated baked flavors green tomato fails to impress
0,-0.5362010615773315,-0.32718476539681934,31,,pale pink color weak aromas bubble gum freshly squeezed lime subtle expression tannic grip rich in texture light in flavor
1,2.135897251930969,11.06348519609006,27,1.0,Rivesaltes dried apricot toasted hazelnut fig ginger sweet spice candied orange rind silky balanced sweet heady walnut skins shiitake mushroom soft salinity long finish mouthwatering age 869 bottles
1,-0.23930124896529814,-0.36212547080015334,25,1.0,Epineuil Burgundy Chablis light fruity Pinot Noir perfumed dusty firm tannins bright red currant raspberry fresh aftertaste
1,1.8389974393189357,2.1536053182398933,7,1.0,12-year old maturity freshness liveliness yeasty edge toasty flavors white fruits balance acidity richness mature fruit complete Champagne
0,-0.833100874189365,-0.1524812383801494,45,,sunny fruity black cherry liqueur cassis mocha-choca soft long finish sweet
0,-1.4269004994134318,0.057162994039854496,25,0.0,sweet candied cherry raspberry carob flavors lacks acidity fruity wine Cartlidge & Browne
1,-0.23930124896529814,-0.7464732302368271,44,,Grenache Blanc Marsanne Roussanne ripe melon peach fruit minerality full broad refreshing weightiness
1,1.2451978140948687,-0.3970661762034873,35,,intensely mineral Sauvignon Blanc crisp citrus flavors fresh complex concentrated ripeness burst from the glass
1,1.5420976267069022,3.201826480339913,7,,grandiose ripe apricot peach flavors mango wood notes fine acidity elegance lemon zest structure full superripe powerful
2,0.9482980014828354,-0.3970661762034873,27,2.0,hearty red wine central Italy grilled meat veal sage leaves prosciutto ham red berries exotic spice leather tobacco firm tannins drink in 3–5 years
0,0.057598563646735254,-0.1874219437834834,7,1.0,Dijon clones sculpted tight compact Chardonnay cocoon decanting elegant tropical fruits stone fruits caramel vanilla cream butter flavors moderate acids
0,0.651398188870802,-0.46694758701015526,27,0.0,debut blend 15% alcohol Yakima Valley Sangiovese solid effort supple polished mixed plum berry silky smooth tangy fruit finish hot flavor price smoked ham spicy clove
0,2.135897251930969,1.9789017912232236,5,,texture velvet palate flavors Cabernet Sauvignon Cab Franc Malbec Petit Verdot new oak approachable softness 6–8 years expensive 344 cases worth the search
2,-0.5362010615773315,-0.7115325248334932,31,2.0,terrific value rosé indigenous grapes Sicily bright pink color fragrant tones raspberry white almond rose petal
0,1.2451978140948687,0.40657004807319436,5,,2006 tight tart raspberry plum natural acids polished tannins long finish toasted coconut chocolate malt Rollat collector cellar Edouard
0,-0.23930124896529814,-0.04765912217014746,5,,light strawberry raspberry Bing cherry medium weight nicely ripened soft tannins balance
3,-1.4269004994134318,-0.46694758701015526,40,3.0,2007 Ribera del Duero young wines narrow sour fruit funk pickle jamminess red fruit thin pushy anemic flavors rough mouthfeel 2006
0,0.9482980014828354,0.057162994039854496,7,0.0,Willamette Valley Tualatin Estate Bill Fuller 40th vintage tawny gold honeycomb pineapple potent focused bee pollen preserved lemon
2,0.651398188870802,0.7559771021065341,33,2.0,Fattoria Scopone 2004 Riserva charred aromas campfire liquid smoke barbecue sauce fresh fruit ripe mature cherry strawberry smooth silky long lasting
2,-1.1300006868013983,-0.5018882924134892,20,,lean sharp herbal apéritif sour-cream tangy citrus cinnamon-spiced pear
0,-0.833100874189365,-0.8862360518501631,7,,rich creamy pineapples green apples cinnamon spice balanced crisp acidity bargain
0,-0.833100874189365,-0.6765918194301591,17,,oak barrel chocolate toast strawberry fruit
1,-1.1300006868013983,-0.8512953464468291,20,,fresh crisp fruity light rosé alternative red wine turkey ham dinner clean finish round finish red berry fruits
2,-0.23930124896529814,-0.29224405999348535,32,2.0,Morellino di Scansano fruit-forward pasta home cooked meals aromas cherry cola spice blackberry dried Mediterranean herbs
0,-1.1300006868013983,-0.46694758701015526,25,,cola-like earthy notes tobacco leather lean strong tannins bitterness acids
0,1.5420976267069022,0.7559771021065341,25,,best barrels chocolate caramel cherry cassis cola Dr. Pepper tobacco pepper richness depth lingering finish
0,0.651398188870802,-0.43200688160682127,5,0.0,Dry Creek Valley Cabernet woolly edge briary pushy tannins wild blackberries oak vanilla smoke
2,1.5420976267069022,0.8607992183165362,33,,riserva textured granular mouthfeel leather tobacco dried berry cola flavors fresh menthol-driven
0,-1.1300006868013983,-0.04765912217014746,27,,Bacio Divino Sangiovese blend soft cherry cocoa spice structural integrity alcohol warm dry finish
0,2.135897251930969,-0.25730335459015136,7,,massive opulent pineapple créme brulée honey buttered toast cinnamon spice decadent citrusy acidity lobsters drawn butter hedonism fantastic price
0,-0.23930124896529814,-0.11754053297681542,25,,light berry fruit alcohol around 13% pale color plenty of acidity tightly wound bottle age aromas tomato leaf fades gently
0,1.8389974393189357,0.7210363967032002,25,,2011 best Pinots brilliant acidity light texture coast concentrated fruit cola spice flavors esteemed vineyard highly complex dry delicious age well six years
0,-1.4269004994134318,0.930680629123204,25,,heavy sugary sweet cherry pie filling lacking structural integrity dryness reputation vineyard
0,-1.1300006868013983,-0.8163546410434951,4,,Reserve Cab Franc rustic simple stewed cherry flavors bitter finish everyday fare
0,0.651398188870802,-0.5018882924134892,24,,tart dense flavorful Pinot Gris grapefruit sour orange apple green banana juice mid-palate fruit-driven finish
2,-0.23930124896529814,-0.43200688160682127,27,,violet plum leather baking spice black cherry star anise clove tannins easygoing no-fuss drink soon
0,-1.1300006868013983,-0.8163546410434951,5,,bone dry sharp harsh texture minty flavors black cherries everyday sipper casual foods
1,-1.4269004994134318,-0.9561174626568311,5,,well-structured juicy fruity aromas redcurrants flavors fresh black fruits balanced firm dry tannins acidity
0,0.057598563646735254,-0.7464732302368271,5,,plum black cherry fruit flavors warmly generous round mouthful sweet baking spices
0,0.057598563646735254,-0.8163546410434951,44,,flavorful apples pears peaches fruit polish price long finish structured skin rind flavors
2,0.057598563646735254,-0.22236264918681736,23,,Malpelo ramato-style Pinot Grigio copperish color fresh fragrances citrus rose peach white spice tuna steak raw salmon tartar
2,0.057598563646735254,0.930680629123204,8,,winery 1900s modern oak carpentry cedar cherry fruit chewy texture smoke flavors spice-driven finish
0,-0.833100874189365,-0.5717697032201572,4,,berry scented fresh mint aromas toasty oak ripe tannins soft tannins bright acidity
3,0.3544983762587686,-0.6067104086234912,27,,black as night chunky sweet candied aromas bacon shoe polish cough medicine modern-styled wine intense roasted berry herb exotic spice flavors licorice prune coffee oak broad finish very ripe big overripe
0,-1.1300006868013983,-0.25730335459015136,28,0.0,Mourvèdre Syrah Rhône varieties warm-climate California jammy cherry blackberry spice sweet simple
1,0.9482980014828354,0.4764514588798623,37,1.0,Viognier Syrah Saint-Joseph cherry-berry fruit floral aromas pepper drink now–2015
2,0.651398188870802,-0.11754053297681542,5,,elegant expression Cabernet Sauvignon smooth aromas wild berries cherry light shadings spice toast crisp generous palate smooth texture determined texture
0,-1.1300006868013983,0.02222228863652051,44,,Bordeaux varieties crisp overtly sweet jammy flavors pineapples lemons limes
3,0.9482980014828354,1.6294947371898838,39,3.0,Rioja prune blackberry leather palate berry flavors smooth tannins zest dry vanilla acidic traditional food pairing 2016 250 cases
0,-1.1300006868013983,-0.25730335459015136,21,,tough extremely dry acidic-tannic blackberry bitter cherry blueberry smoky oak not ready hard to predict try after 2008
1,0.3544983762587686,-0.25730335459015136,35,,talcum powder orange peel fresh-cut grass bouquet melon apple lemon peach good lively imported Vineyard Brands
0,0.057598563646735254,-0.22236264918681736,2,,Merlot Cabernet Franc aromas dried herbs pencil lead cherry spice palate elegant style tannins
1,-1.1300006868013983,-0.7814139356401612,29,,melon almond pineapple tart metallic finish breadth palate
0,-1.723800312025465,-0.32718476539681934,25,,low alcohol 12.2% thin on fruit yeasty bread dough stemmy tannins
0,-1.4269004994134318,-0.11754053297681542,25,,2004 vintage sourcing differences sharp green minty cherry cola simple thin rich spiciness
2,-0.23930124896529814,-0.1874219437834834,27,,blend Cabernet Merlot Syrah heat power cooked fruit jammy fruit warm tones soft leather sweet pipe tobacco
0,0.651398188870802,1.8041982642065537,5,,Cabernet extracted jammy extreme ripeness fruit-forwardness sweet oak new cream vanilla buttered toast juicy New World style
0,-1.1300006868013983,-0.32718476539681934,37,,ripe black currant raisins prunes smoky oak caramelized Port-like dry crisp acids
0,-0.833100874189365,-0.46694758701015526,4,,light red fruits stewed herbal soft mouthfeel mocha-streaked finish
0,-0.5362010615773315,-0.7115325248334932,7,,creamy vanilla pudding buttered toast pineapple jam slightly sweet Chardonnay crisp streak of acidity balance richness
1,1.8389974393189357,0.19692581565319042,30,,rich Riesling off dry intense acidity white currant hedgerow fruits concentrated texture full-bodied very ripe superbly structured very fruity age 6–8 years
2,0.651398188870802,0.057162994039854496,32,2.0,La Prima Sangiovese Canaiolo Colorino barriques dark color black plums violets oak blackberry plum floral notes rich chewy long finish
2,0.651398188870802,0.12704440484652246,20,2.0,noble white grape subtle aromas white flowers yellow flowers beeswax slate juicy palate white peach cantaloupe pink grapefruit mineral fresh acidity
0,0.057598563646735254,-0.46694758701015526,25,,Carabella budget Pinot country flavors bright vivid tart fruit berries cherries full-bodied forward expression surprising depth fine balance
0,1.2451978140948687,0.09210369944318848,7,,young tight strong acidity bitter lime zest gooseberry tartness nobly structured cellar extended decanting oxygen tropical fruits buttercream oak
2,-0.23930124896529814,1.454791210173214,27,,Cabernet Sauvignon Cabernet Franc Merlot Petit Verdot aromas leafy underbrush mature plum toast roasted coffee bean palate prune dried cherry black pepper graphite espresso dusty tannins heat of alcohol midpalate
1,0.651398188870802,0.23186652105652442,25,,juicy red-fruit flavors rich solid chunky concentrated jammy red-plum flavors firm tannins intense acids age for six-plus years
0,-0.5362010615773315,0.23186652105652442,29,,2005 cool vintage lean alcohol citrus flavors dry flinty Marsanne Roussanne Viognier blend thin
1,0.9482980014828354,0.5812735750898642,25,,solid wine plum skin dry tannin ripe fruit 2009 attractive red fruits juicy acidity aging fruitiness
3,-1.4269004994134318,-0.6067104086234912,42,,"tan-gold color fading aromas canned pineapple not fresh finish fleshy fat Imported by Alconde Vineyards, LLC"
3,-0.5362010615773315,-0.6765918194301591,39,,smooth ripe nose forest bacon road tar violets plum blackberry juicy raw racy slick broad medicinal hot vintage
0,-0.23930124896529814,-0.6416511140268252,43,0.0,Lonesome Spring Ranch fresh juicy citrus orange peel flavors
0,0.651398188870802,1.280087683156544,5,0.0,rich soft oaky Cabernet blackberry cherry jam cassis mocha olive class distinction vineyard Napa Sonoma
0,0.057598563646735254,0.5812735750898642,25,,2007 release 2008 blend four vineyards great fine wine cherry cola spice flavors raw decant few hours
0,-0.23930124896529814,0.8607992183165362,25,0.0,Goldeneye Pinot rich cherries raspberries cola red currant licorice sandalwood elegantly crisp mouthfeel lacks excitement drink now
0,-0.23930124896529814,-0.46694758701015526,37,0.0,Syrah soft gentle raspberry cherry spice tobacco herb smoke warm-climate Paso Robles
0,-0.23930124896529814,-0.7115325248334932,20,,cranberry cherry orange peel vanilla tart fresh puckering fruit flavors dinner table
1,-0.23930124896529814,-0.1874219437834834,7,1.0,Petit Chablis serious complex ripe green fruits ripe yellow fruits caramel toast
0,-1.723800312025465,-0.6416511140268252,7,,dull watery alcohol modest citrus flavors
2,-0.5362010615773315,-0.8163546410434951,20,2.0,Fresh crispness luminous bright Soave Garganega grapes aromas lemon zest white mineral pear
0,0.651398188870802,-0.5018882924134892,6,,brut classically structured Pinot Noir Chardonnay dry crisp fine mousse creamy smooth mouthfeel pineapple raspberry vanilla delicious
2,-0.5362010615773315,2.3283088452565632,32,,aromas stewed prune fig toasted oak palate dried berry roasted coffee bean vanilla anisette tannins alcohol finish
2,-0.5362010615773315,-0.8512953464468291,9,,charming green plums red berries earth palate intensity cassis flavor fresh-roasted coffee bracing acidity cheese-laden dish lasagna drink now one year
1,0.057598563646735254,-0.7814139356401612,28,,menthol black licorice African violets ripe plum dark cherries cocoa fresh mint leaves balance silky texture clean finish
0,-0.833100874189365,-0.43200688160682127,25,,softly appealing Pinot cherry pie brown sugar cinnamon Pinot Noir silky texture
0,-0.833100874189365,0.23186652105652442,7,,earthy crisp very dry steely minerality modest fruit green apples pineapples
0,-1.723800312025465,-0.46694758701015526,7,,vegetal sweet finish pineapple candy not particularly successful
0,0.3544983762587686,-0.11754053297681542,25,,light mouthfeel dry texture cola tart cherryskin ripe rhubarb coffee Asian spices caramelized oak complex swirl
0,-0.5362010615773315,-0.04765912217014746,5,,pungent grapey violets dusty chocolate astringent fruit varietal cassis charred coffee ground flavors finish
0,-0.5362010615773315,-0.6067104086234912,25,,Pinot aromas strawberry cherry flowers juicy berry flavors balsamic pepper good structure lingering finish
0,-2.3175999372495317,-0.5368289978168233,35,0.0,Greenwood Ridge Sauvignon Blanc unripe feline flavors off-dry residual sugar 1.9%
0,0.651398188870802,0.057162994039854496,25,,huge in flavor black cherries red cherries pomegranates sweet rhubarb pie coffee vanilla light in color silky in body crisp acids complexity finest entrées
2,0.057598563646735254,0.23186652105652442,27,2.0,red wine Piedmont Nebbiolo Vespolina berry spice cola tonic fresh clean acidity exotic spice
0,1.8389974393189357,0.09210369944318848,25,,luscious bright spicy wild cherry raspberry root beer satiny texture brilliant acidity stunningly drinkable develop over the next six years
0,-0.5362010615773315,0.09210369944318848,45,0.0,rich ripe blackberry jam chocolate anise spice California sunshine high alcohol drink now
2,0.9482980014828354,0.19692581565319042,10,,Cometa golden color aromas tropical fruit ripe citrus Fiano minerality weight length finish anise honey limes oranges
0,-1.1300006868013983,-0.6416511140268252,17,0.0,Paso soft chocolaty Merlot acidity flavor ripe crushed blackberries
0,0.057598563646735254,0.6511549858965322,5,,gritty dry tannins old-fashioned lush sweet Cabernet rich core blackberry black currant time in the cellar hold until 2017
0,-0.833100874189365,0.7559771021065341,7,,roasted nuts banana caramel smoke pear baked apple apricot coconut scotch edgy acidity
0,0.057598563646735254,-0.5018882924134892,25,,light style stylish finesse good structure plum fruit cocoa softening tannins spice gentle beguiling near-term enjoyment
0,-0.833100874189365,-0.43200688160682127,17,,aromas sun-dried tomatoes coffee cinnamon toast blackberries currants light fruity spice soft tannins dry red table wine
3,-0.23930124896529814,-0.1874219437834834,40,,light raspberry charred wood modest nose sweeter strawberry mildly creamy easygoing palate buttery finish toast popcorn notes semi-successful
