country,description,points,price,variety,contains_location,country_from_location,keywords
Italy,"Here's a fresh and easy blend of Trebbiano, Chardonnay and Sauvignon (at an attractive low price) that offers clean, but not very intense, aromas of cut grass, field flowers and lemon. The wine renders a sweet, chewy sensation in the mouth with soft texture and a creamy finish.",84,11.0,White Blend,False,None,"['fresh', 'easy blend', 'Trebbiano', 'Chardonnay', 'Sauvignon', 'low price', 'clean aromas', 'cut grass', 'field flowers', 'lemon', 'sweet sensation', 'chewy', 'soft texture', 'creamy finish']"
US,"Though varietally labeled, this intriguing white Rhône includes 12% each Marsanne and Grenache Blanc. Rich and satisfying, it brings the buttery density of a ripe Chardonnay, but mixes the fruits for more drama—cantaloupe, apricot, banana, and a bit of papaya. A total yum-fest.",91,22.0,Viognier,False,None,"['white Rhône', 'Marsanne', 'Grenache Blanc', 'buttery density', 'ripe Chardonnay', 'cantaloupe', 'apricot', 'banana', 'papaya', 'yum-fest']"
Italy,"This is a delicate and feminine rosé sparkler that opens with a beautifully pale pink color and subtle aromas of wild berry, tangerine skin, white almond and passion fruit. It shows elegance on the palate, with fine perlage and tangy crispness.",90,37.0,Sparkling Blend,False,None,"['delicate', 'feminine', 'rosé', 'sparkler', 'pale pink', 'wild berry', 'tangerine skin', 'white almond', 'passion fruit', 'elegance', 'palate', 'fine perlage', 'tangy crispness']"
US,"This is blended from two finished wines: a 2005 Counoise (64%) and a 2006 Viognier (36%). It's ripe and round and showing strawberry and peach flavors. The two grapes work together well, and create a seamless wine with plenty of fruit power.",86,18.0,Rosé,False,None,"['blended', 'Counoise', 'Viognier', 'ripe', 'round', 'strawberry', 'peach', 'seamless', 'fruit power']"
France,"A very perfumed ripe wine. The fruit flavors range from mango through peach to a taut citric finish. With just a hint of wood, this is a bright and fruity wine, delicious to drink now.",88,75.0,Chardonnay,False,None,"['perfumed', 'ripe', 'fruit flavors', 'mango', 'peach', 'citric finish', 'hint of wood', 'bright', 'fruity', 'delicious']"
US,"Sharp and a bit green, this has peavine and citrus flavors, the citrus a mix of flesh, rind, and sour candy. It was fermented in 100% stainless.",85,22.0,Viognier,False,None,"['sharp', 'green', 'peavine', 'citrus flavors', 'flesh', 'rind', 'sour candy', 'fermented', 'stainless']"
US,"Soft, ripe and decadent, this Pinot, from the Napa side of Carneros, brims with blackberry, cherry, cola, vanilla, licorice and cinnamon spice flavors. It's full-bodied, but has Pinot's elegant silkiness. At its best now and for a couple years.",87,40.0,Pinot Noir,True,US,"['soft', 'ripe', 'decadent', 'Pinot', 'Carneros', 'blackberry', 'cherry', 'cola', 'vanilla', 'licorice', 'cinnamon spice', 'full-bodied', 'elegant', 'silkiness', 'best now', 'couple years']"
US,"Lots of delicious raspberry and cherry flavors in this spicy wine, but it's just too sweet. That's probably a combination of residual sugar and extraordinarily high alcohol of 16.5%, which makes it almost Port-like.",87,35.0,Zinfandel,False,None,"['raspberry', 'cherry', 'spicy', 'sweet', 'residual sugar', 'high alcohol', '16.5%', 'Port-like']"
US,"Cabernet Franc has been the signature wine for Barrister since the first release in 2001. Once again it comes out dark and smoky in the house style, but with more spine and muscle than the Barrister Merlot. It's fully ripe and not at all vegetal, though you will find that it has the characteristic Cab Franc streak of pepper and coffee behind ripe black cherry and cassis fruit.",90,27.0,Cabernet Franc,False,None,"['Cabernet Franc', 'Barrister', 'dark', 'smoky', 'spine', 'muscle', 'fully ripe', 'not vegetal', 'pepper', 'coffee', 'ripe black cherry', 'cassis fruit']"
US,"Wow—delicious, the best yet. Lots of pineapple from the 75% Celilo fruit, very crisp and lightly butterscotchy. Big but not heavy, with alcohol in the mid-13% range. The wine fills in the midpalate nicely, weaving together rock, metal, butter and tropical fruit flavors in equal proportions. Good length also.",91,35.0,Chardonnay,True,US,"['delicious', 'pineapple', 'Celilo fruit', 'crisp', 'butterscotchy', 'mid-13% alcohol', 'midpalate', 'rock', 'metal', 'butter', 'tropical fruit', 'good length']"
US,"This is a nice Chardonnay to drink with shellfish, particularly grilled shrimp. It's dry and crisp in acidity, with rich pineapple, green apple and pear flavors, accented with sweet, toasty oak.",88,16.0,Chardonnay,False,None,"['Chardonnay', 'shellfish', 'grilled shrimp', 'dry', 'crisp acidity', 'rich pineapple', 'green apple', 'pear flavors', 'sweet oak', 'toasty oak']"
Italy,"Aurelio Settimo's lively Dolcetto offers a surprise twist in the form of black fruit, Indian spice and natural rubber. The overall effect is rich in cherry and sweet fruit and the wine tastes plush and creamy on the close.",88,25.0,Dolcetto,True,Italy,"['Aurelio Settimo', 'lively Dolcetto', 'black fruit', 'Indian spice', 'natural rubber', 'rich', 'cherry', 'sweet fruit', 'plush', 'creamy']"
US,"This is pure Cabernet Sauvignon, with pretty, ripe berry and plum fruit flavors in abundance. The toasty frame, medium tannins and hints of dried leaf add to the overall composition of this nicely-balanced, limited-production wine.",90,38.0,Cabernet Sauvignon,False,None,"['Cabernet Sauvignon', 'ripe berry', 'plum fruit', 'toasty frame', 'medium tannins', 'dried leaf', 'balanced', 'limited-production']"
US,"As comfortable as an old shoe, the Grand Estates Chardonnay from Columbia Crest delivers broad, open flavors of buttered fruit – almost like biting into a slice of apple pie, crust and all. Hard to argue with it, all 160,000 cases strong.",86,11.0,Chardonnay,True,US,"['Grand Estates Chardonnay', 'Columbia Crest', 'buttered fruit', 'apple pie', 'broad flavors', '160,000 cases']"
Italy,"Juicy and round, this opens with scents of honeysuckle, yellow stone fruit and a hint of aromatic herb. The full-bodied palate offers ripe white peach, pear and a hint of candied lemon drop while a mineral note backs up the finish.",89,21.0,Fiano,False,None,"['juicy', 'round', 'honeysuckle', 'yellow stone fruit', 'aromatic herb', 'full-bodied', 'ripe white peach', 'pear', 'candied lemon drop', 'mineral note', 'finish']"
France,"This, the second wine from Clos de la Maréchale, is light, very fresh, dusty in texture, the tannins held in suspension, with red plum and cranberry flavors.",87,47.0,Pinot Noir,True,France,"['second wine', 'Clos de la Maréchale', 'light', 'fresh', 'dusty texture', 'tannins', 'red plum', 'cranberry flavors']"
US,"Pretty dark and full-bodied for a rosé, and too extracted and heavy in cherry-berry flavors to be considered elegant. It's almost a red wine you could drink at room temperature.",82,10.0,Rosé,False,None,"['dark', 'full-bodied', 'rosé', 'extracted', 'heavy', 'cherry-berry flavors', 'elegant', 'red wine', 'room temperature']"
France,"This tight, taut and crisp wine needs some time to bring out its true fruity character. Behind the texture, ripe green plums and fresh apples are cut with lime juice. The wine is still young and could benefit from a few more months. Drink from late 2015.",89,18.0,Melon,False,None,"['tight', 'taut', 'crisp', 'fruity character', 'ripe green plums', 'fresh apples', 'lime juice', 'young', 'benefit', 'drink from late 2015']"
Italy,"Aromas of brandied cherry, crushed violet black pepper and a whiff of exotic spice lead the way. The round palate doles out dried plum, raisin, nutmeg, vanilla and a confectionary note alongside velvety tannins. Drink 2016–2021.",90,60.0,Red Blend,False,None,"['brandied cherry', 'crushed violet', 'black pepper', 'exotic spice', 'dried plum', 'raisin', 'nutmeg', 'vanilla', 'confectionary note', 'velvety tannins']"
US,"This starts light, with wild berry and bramble flavors, but it's nicely balanced and persists across the palate with pleasant milk chocolate flavors. Well integrated with good acids, this 100% varietal Merlot is pleasurable and easy drinking.",88,22.0,Merlot,False,None,"['light', 'wild berry', 'bramble flavors', 'balanced', 'milk chocolate', 'well integrated', 'good acids', '100% varietal Merlot', 'pleasurable', 'easy drinking']"
US,"Give this fresh young Pinot a year to mellow. Right now, it's jammy in raspberries and cherries, with a citric sharpness. Needs brief time to knit together and become seamless.",87,35.0,Pinot Noir,False,None,"['fresh', 'young', 'Pinot', 'mellow', 'jammy', 'raspberries', 'cherries', 'citric sharpness', 'knit together', 'seamless']"
US,"An exquisite wine that combines delicacy and harmony with enormously fruity-spicy flavors that fill the mouth. The aromas suggest candied ginger, tropical fruits, vanilla and wildflowers. The flavors are effusively fruity and on the dry side, with refreshingly crisp acidity. Try it with Asian-Pacific fusion foods.",87,12.0,Gewürztraminer,False,None,"['exquisite wine', 'delicacy', 'harmony', 'fruity-spicy flavors', 'candied ginger', 'tropical fruits', 'vanilla', 'wildflowers', 'effusively fruity', 'dry', 'refreshingly crisp acidity', 'Asian-Pacific fusion foods']"
US,"Great price for this unoaked white wine. It's smooth and crisp in mouthwatering acidity, with ripe flavors of citrus fruits, lemongrass, minerals and vanilla that finish with a honeyed richness. Easy to find, with production of 21,696 cases.",87,12.0,Fumé Blanc,False,None,"['unoaked', 'white wine', 'smooth', 'crisp', 'mouthwatering acidity', 'citrus fruits', 'lemongrass', 'minerals', 'vanilla', 'honeyed richness', 'easy to find', 'production', '21,696 cases']"
France,"A pure strawberry jam wine, its ripe fruit scintillating with freshness and acidity. The wine is also round, with tannins giving some weight. The aftertaste is deliciously fruity.",89,17.0,Gamay,False,None,"['strawberry jam', 'ripe fruit', 'freshness', 'acidity', 'round', 'tannins', 'weight', 'aftertaste', 'fruity']"
Italy,"La Giaretta is an up-and-coming winery in full evolution with a modern approach and excellent pricing. There are deep oak aromas here that thankfully do not overwhelm delicate notes of cherry cola, cough drop, Indian spice, herbal infusion and almond. This is a spice-driven wine with a velvety texture and lively fruit on the finish.",91,23.0,"Corvina, Rondinella, Molinara",True,None,"['La Giaretta', 'up-and-coming winery', 'modern approach', 'excellent pricing', 'deep oak aromas', 'cherry cola', 'cough drop', 'Indian spice', 'herbal infusion', 'almond', 'spice-driven wine', 'velvety texture', 'lively fruit', 'finish']"
Spain,"Warm and smelling of menthol, cough syrup and sweet, jammy berry fruit. The palate is also fairly medicinal in terms of flavor, while the feel is a bit hard and underdeveloped. Turns more tart and herbal the more you get to know it.",83,14.0,Tempranillo,False,None,"['warm', 'menthol', 'cough syrup', 'sweet', 'jammy berry fruit', 'medicinal', 'hard', 'underdeveloped', 'tart', 'herbal']"
US,"Luscious, long, full-bodied and rich, a wonderful wine that showcases its appellation. Has well-ripened flavors of blackcurrants and cassis that drink long and deep, although there's some hollowness, which costs it a few points. The flavors are wrapped in soft, easy but complex tannins. Fully dry and nicely oaked, this wine is immediately enjoyable.",90,35.0,Cabernet Sauvignon,False,None,"['luscious', 'long', 'full-bodied', 'rich', 'well-ripened flavors', 'blackcurrants', 'cassis', 'hollowness', 'soft tannins', 'easy tannins', 'complex tannins', 'fully dry', 'nicely oaked', 'immediately enjoyable']"
Spain,"Aromas of barrel spice and grilled pineapple are solid, while the palate is thick and creamy with orange marmalade and banana flavors. If you like a thick, unctuous Chard with a glob of oak, this is it. Has its strong points but tastes too much like cinnamon stick and wood. Imported by Dreyfus, Ashby & Co.",84,24.0,Chardonnay,False,None,"['barrel spice', 'grilled pineapple', 'thick', 'creamy', 'orange marmalade', 'banana flavors', 'unctuous', 'oak', 'cinnamon stick', 'wood']"
US,"Impresses for the sheer volume of the fruit. Flamboyant tropical pineapple, mango, guava, lots of dusty spices, rich oak, but manages to hold onto balance, dryness and even a sense of finesse all the way through the long finish.",92,39.0,Chardonnay,False,None,"['volume of the fruit', 'tropical', 'pineapple', 'mango', 'guava', 'dusty spices', 'rich oak', 'balance', 'dryness', 'finesse', 'long finish']"
US,"Sweet meets earthy, with aromas that recall grilled beets, cola and sassafras. The bottling comes from the father-son team of Tondré and Joe Alarid, who planted their vineyard in 1997 and combined have nearly a century's worth of farming experience in the Salinas Valley. Homemade cranberry sauce wins the palate, and the wine has more tannins than most Pinot Noirs of similar age. Enjoy now or cellar until 2016 for even more emerging flavors.",91,40.0,Pinot Noir,True,US,"['sweet', 'earthy', 'aromas', 'grilled beets', 'cola', 'sassafras', 'Tondré', 'Joe Alarid', 'vineyard', '1997', 'farming experience', 'Salinas Valley', 'homemade cranberry sauce', 'palate', 'tannins', 'Pinot Noir', 'cellar', 'emerging flavors']"
US,"The nose is volatile and pruney, the color dark, almost Port-like. The wine is very soft and flat. The fruit seems waxy and dead, lightly pruney but also a bit green; it tastes as though half the grapes were underripe and half were raisined.",84,32.0,Merlot,False,None,"['volatile', 'pruney', 'dark', 'Port-like', 'soft', 'flat', 'waxy', 'dead', 'underripe', 'raisin']"
US,"On the sharp and lean side, showing sour red cherry candy, wintergreen and green peppercorn flavors, fattened with sweet oak. Dry and elegant, but not very rich. Drink up.",86,56.0,Pinot Noir,False,None,"['sharp', 'lean', 'sour red cherry candy', 'wintergreen', 'green peppercorn', 'sweet oak', 'dry', 'elegant', 'not very rich', 'drink up']"
US,"A massive wine that could only have been grown under the California sun. Shows enormously ripe flavors of red and black currants, cola, red plums and spices, enriched with significant oak. Not particularly nuanced or elegant now due to the obvious power. Could age out, but the future is uncertain.",87,48.0,Pinot Noir,True,US,"['massive wine', 'California sun', 'ripe flavors', 'red currants', 'black currants', 'cola', 'red plums', 'spices', 'significant oak', 'power', 'age out', 'uncertain future']"
US,"A blend of Cabernet Sauvignon, Cabernet Franc and Merlot, this wine's fruit is sourced entirely from the Conner Lee Vineyard. The superjuicy black-cherry flavor is balanced by generous acidity. Vibrant and full, long and fresh, this could age gracefully for a decade or more.",92,30.0,Meritage,True,US,"['blend', 'Cabernet Sauvignon', 'Cabernet Franc', 'Merlot', 'Conner Lee Vineyard', 'black-cherry flavor', 'generous acidity', 'vibrant', 'full', 'long', 'fresh', 'age gracefully']"
US,"Tastes sweet, with cherry and blackberry jelly flavors, but racy and clean in acidity, like a simple, by-the-glass wine at a fast food restaurant.",82,8.0,Merlot,False,None,"['sweet', 'cherry', 'blackberry jelly', 'racy', 'clean acidity', 'simple', 'by-the-glass', 'fast food restaurant']"
US,"Rounded aromas of melon and salty peaches rise to the nose on this wine from the Monterey County appellation just south of the Santa Lucia Highlands. The palate is driven by citrus, grass and a rather extreme sense of sea salt, enhanced with mouth-watering acidity and a nectarine flesh finish. It's tasty though varietally uncommon.",88,25.0,Sauvignon Blanc,True,US,"['rounded aromas', 'melon', 'salty peaches', 'Monterey County', 'Santa Lucia Highlands', 'citrus', 'grass', 'sea salt', 'mouth-watering acidity', 'nectarine flesh finish', 'tasty', 'varietally uncommon']"
US,"A pear, apple-orange and earth bouquet sets the stage for a palate chockful of pineapple, pear and lemon flavor. Toast notes offset and vibrant acidity uplifts the fruit nicely. The finish is long and tart-sweet with complex leesy, earthy notes. Medium-bodied and restrained, this complex wine shows depth. Give it six months to a year to unfold.",89,37.0,Chardonnay,False,None,"['pear', 'apple-orange', 'earth bouquet', 'pineapple', 'lemon flavor', 'toast notes', 'vibrant acidity', 'long finish', 'tart-sweet', 'leesy', 'medium-bodied', 'restrained', 'complex', 'depth', 'six months', 'year']"
US,"A soft, medicinal and uninteresting wine, marked by harshness and green flavors that barely suggest cherries.",80,12.0,Zinfandel,False,None,"['soft', 'medicinal', 'uninteresting', 'harshness', 'green flavors', 'cherries']"
US,"This is sort of a second wine from Reverie. It's rustic and sharp, with tart, jellied blackberry and cherry flavors. Not going anywhere.",83,40.0,Bordeaux-style Red Blend,True,US,"['second wine', 'rustic', 'sharp', 'tart', 'jellied', 'blackberry', 'cherry', 'flavors', 'not going anywhere']"
US,"A nice, slightly sweet white wine, with tropical fruit, buttered toast, white flower and vanilla flavors. Easy to drink as a cocktail sipper.",86,22.0,Marsanne,False,None,"['slightly sweet', 'white wine', 'tropical fruit', 'buttered toast', 'white flower', 'vanilla flavors', 'easy to drink', 'cocktail sipper']"
US,"Soft and semisweet, with the honeyed, lemon-and-lime Gatorade taste, this everyday white is simple and clean.",83,19.0,Sauvignon Blanc,False,None,"['soft', 'semisweet', 'honeyed', 'lemon', 'lime', 'Gatorade taste', 'everyday white', 'simple', 'clean']"
Italy,"A sophisticated blend of Merlot, Cabernet and Sangioveto from the newly inaugurated Frassinello winery designed by architect Renzo Piano. It has deeply etched oak tones over blueberry and forest berry. The close is fresh and crisp with very good length.",90,45.0,Red Blend,True,Italy,"['sophisticated blend', 'Merlot', 'Cabernet', 'Sangioveto', 'Frassinello winery', 'Renzo Piano', 'oak tones', 'blueberry', 'forest berry', 'fresh', 'crisp', 'very good length']"
Italy,"Ripe fruit notes of black cherry and raspberry are followed by chocolate and delicate spice. This 80-20 blend of Sangiovese and Merlot from Maremma, Tuscany is sharp and well-focused in the mouth with lingering tones of ripe fruit and a crisp berry finale.",88,25.0,Red Blend,True,Italy,"['ripe fruit', 'black cherry', 'raspberry', 'chocolate', 'delicate spice', 'Sangiovese', 'Merlot', 'Maremma', 'Tuscany', 'sharp', 'well-focused', 'lingering tones', 'crisp berry finale']"
US,"With each bump up in price, the winemaker ups the percentage of new oak; here it's 25%. Half the fruit is estate grown, and this light, clean, well-balanced wine drinks like a village Burgundy, with the right hint of herb around the tart red fruit.",88,18.0,Pinot Noir,True,France,"['new oak', 'estate grown', 'light', 'clean', 'well-balanced', 'village Burgundy', 'herb', 'tart red fruit']"
Italy,"Ripassá is a wine that has been refermented on the skins to produce extra richness and intensity of aromas. This distinctive wine offers tones of blackberry jam, currant, clove and curry powder. It's a luscious and slightly sweet tasting wine with chewy tannins.",88,18.0,Red Blend,False,None,"['Ripassá', 'refermented', 'richness', 'intensity', 'aromas', 'blackberry jam', 'currant', 'clove', 'curry powder', 'luscious', 'slightly sweet', 'chewy tannins']"
US,"Very ripe and aromatic, throwing out cascades of inviting scents. New toasty oak dominates, with undercurrents of blackberry jam, blueberry, mocha and anise. In the mouth, huge, lush, powerful, an explosively fruity young wine, yet maintains balance and elegance. Really good. Best now–2015.",94,95.0,Cabernet Sauvignon,False,None,"['ripe', 'aromatic', 'toasty oak', 'blackberry jam', 'blueberry', 'mocha', 'anise', 'lush', 'powerful', 'fruity', 'balance', 'elegance', 'best now–2015']"
US,"Rich and toasty, this has aromas barrel-dominated aromas and flavors of vanilla and sweet, buttery oak. The underlying wine is strong in cherry and balsam flavors, which are girded by considerable tannins. Pair this with game meats, stews or barbecue to wrestle the structural elements into submission.",88,40.0,Pinotage,False,None,"['rich', 'toasty', 'barrel-dominated', 'vanilla', 'buttery oak', 'cherry', 'balsam', 'tannins', 'game meats', 'stews', 'barbecue']"
US,"A feminine wine, soft, gentle and delicious in flavor. Feels light and silky in the mouth, with rich notes of cherries, raspberries, cotton candy, buttered cinnamon toast and sandalwood. Almost sweet, but it finishes nice and dry. Drink now–2013.",88,48.0,Pinot Noir,False,None,"['feminine', 'soft', 'gentle', 'delicious', 'light', 'silky', 'rich notes', 'cherries', 'raspberries', 'cotton candy', 'buttered cinnamon toast', 'sandalwood', 'almost sweet', 'finishes dry', 'drink now–2013']"
US,"Quilceda's single-vineyard Bordeaux-style blend is 76% Cabernet Sauvignon, 14% Cabernet Franc, 7% Merlot and 3% Petit Verdot, from a vineyard just across the road from Champoux. Dusty and fragrant, it suggests soft leather, toast, caramel and coconut, hiding its fruit at first in a wash of luxurious barrel flavors. That fruit emerges with some hours of decanting, a tart and racy mix of berry and sweet tomato.",93,85.0,Red Blend,True,US,"['Quilceda', 'single-vineyard', 'Bordeaux-style blend', 'Cabernet Sauvignon', 'Cabernet Franc', 'Merlot', 'Petit Verdot', 'dusty', 'fragrant', 'soft leather', 'toast', 'caramel', 'coconut', 'luxurious barrel flavors', 'tart', 'racy', 'berry', 'sweet tomato']"
US,"The Cabernet Sauvignon is from vines planted in 1972—fruit that once went into Leonetti Cab. The other half is evenly split between Merlot and Cab Franc, crafting a flavor mix of herb and earth, with moderate density. It's nicely spiced, with brambly red fruits, and some butterscotch coming into the finish.",89,45.0,Red Blend,True,US,"['Cabernet Sauvignon', '1972', 'Leonetti Cab', 'Merlot', 'Cab Franc', 'herb', 'earth', 'moderate density', 'spiced', 'brambly red fruits', 'butterscotch', 'finish']"
US,"Some Cabs go into a dip at the age of five, and this may be one of them. It's a little awkward in structure, with a sharpness of feeling, and the oak isn't integrated with the ripe blackberry fruit. Could emerge and be fine in a couple more years.",86,42.0,Cabernet Sauvignon,False,None,"['Cabs', 'age of five', 'awkward structure', 'sharpness', 'oak', 'ripe blackberry fruit', 'emerge', 'fine', 'couple more years']"
US,"Showing the rich, exotic side of Viognier, this has ripe, flamboyant flavors of tropical fruit, white flower and spice. It has a controlled dryness and citrusy acidity; this is a lovely, versatile white.",87,24.0,Viognier,False,None,"['Viognier', 'tropical fruit', 'white flower', 'spice', 'controlled dryness', 'citrusy acidity', 'versatile white']"
US,"A meaty Shiraz that pulls no punches, proudly displaying its black raspberry and earthy, salumi-infused flavors around a rich, dense texture full of leather and a touch of smoke. The Temecula Valley is continuing to make strides and this is a jumbo-jet-sized example that finishes a teensy bit sweet. The Shiraz is blended with 11% Cinsault.",88,56.0,Shiraz,True,US,"['Shiraz', 'black raspberry', 'earthy', 'salumi', 'rich', 'dense texture', 'leather', 'smoke', 'Temecula Valley', 'sweet', 'Cinsault']"
Spain,"Aromas of black fruits, light oak and violets are good but basic, and that pretty much defines the rest of the wine. Expect an easy flowing palate with candied, regular berry flavors in front of a light to medium finish. Nicely done and approachable.",87,15.0,Monastrell,False,None,"['aromas', 'black fruits', 'light oak', 'violets', 'easy flowing palate', 'candied berry flavors', 'light to medium finish', 'nicely done', 'approachable']"
US,"Good color, but the very light cranberry fruit flavors have a strong mint streak running down the core of this wine. It's hard to find varietal character here; it's thin, herbal and a bit hard-edged.",84,25.0,Sangiovese,False,None,"['color', 'light cranberry fruit flavors', 'mint streak', 'varietal character', 'thin', 'herbal', 'hard-edged']"
Italy,"Truckloads of fresh banana emerge from the nose, and are backed by vanilla bean, chalky minerality and some vitamin-like aromas. Somewhat dilute on the palate, but those banana notes put in another strong appearance. Imported by Vias Imports.",85,12.0,Pinot Grigio,False,None,"['fresh banana', 'vanilla bean', 'chalky minerality', 'vitamin-like aromas', 'palate', 'dilute']"
US,"The sulfur in my bottle was slow to blow off, and when it did, it revealed a toughly tannic, herbal wine. The tastes range from sage and tobacco to candied Life Saver blackberry and cherry to shriveled currants. Those pesky tannins turn up when you swallow, leaving behind a hard astringency.",83,30.0,Cabernet Sauvignon,False,None,"['sulfur', 'tannic', 'herbal', 'sage', 'tobacco', 'candied', 'blackberry', 'cherry', 'currants', 'astringency']"
US,"Enticing spicy, toasty aromas and robust, dry fruit flavors are matched by very firm, fine-grained tannins in this full-bodied wine. Based on 65% Zinfandel, it has lots to offer, but at this stage an oaky sensation and the astringent mouthfeel indicate that it needs to mellow. Best to drink after 2018.",89,40.0,Red Blend,False,None,"['spicy aromas', 'toasty aromas', 'robust flavors', 'dry fruit flavors', 'firm tannins', 'fine-grained tannins', 'full-bodied', 'Zinfandel', 'oaky sensation', 'astringent mouthfeel', 'mellow', 'drink after 2018']"
US,"Broad across the palate, this brings flavors of orange soda and orange candy, with a grainy impression. It's fruit forward, with a quick fade.",85,22.0,Viognier,False,None,"['broad', 'palate', 'flavors', 'orange soda', 'orange candy', 'grainy impression', 'fruit forward', 'quick fade']"
