country,description,points,price,variety,contains_location,country_from_location,keywords
US,"Fermented 75% whole-cluster and then aged in neutral oak, this wine offers complex, expressive aromas of green olive, fresh herbs, grilled asparagus, earth and peat. The palate brings waves of intensity, with sensuous, layered savory flavors that lead to a hyperextended finish. It's an exclamation point of a wine that shows the promise of this young winery and vineyard.",94,50.0,Syrah,False,None,"['fermented', 'whole-cluster', 'aged', 'neutral oak', 'complex', 'expressive aromas', 'green olive', 'fresh herbs', 'grilled asparagus', 'earth', 'peat', 'intensity', 'savory flavors', 'hyperextended finish', 'young winery', 'vineyard']"
US,"Lots of bang for the buck here. Offers mouth-filling, juicy blackberry, cherry, pomegranate and coffee flavors in a bone-dry, soft wine, with a fairly complicated tannin structure. Drink now.",87,15.0,Merlot,False,None,"['bang for the buck', 'mouth-filling', 'juicy', 'blackberry', 'cherry', 'pomegranate', 'coffee', 'bone-dry', 'soft', 'complicated tannin structure', 'drink now']"
US,"This is a very ripe wine stuffed with blackberries, cherries and cocoa, but it's also pretty tannic, although sweet oak softens the blow. Feels lush and good, but rustic around the edges. Drink now with beef dishes.",86,16.0,Meritage,False,None,"['ripe', 'blackberries', 'cherries', 'cocoa', 'tannic', 'sweet oak', 'lush', 'rustic', 'beef dishes']"
US,"This wine opens with the fresh liveliness of stemmy earth and black tea notes, growing funkier and more herbal on the midpalate. Brightly layered and deeply flavored, it's a full-bodied rendition that remains true to its variety.",91,35.0,Pinot Noir,False,None,"['fresh liveliness', 'stemmy earth', 'black tea', 'funky', 'herbal', 'brightly layered', 'deeply flavored', 'full-bodied', 'true to its variety']"
US,"This is the kind of wine that will be wildly popular as a cocktail sipper. It has the fruit, spice and oaky vanilla to appeal to almost all palates, yet is dry and crisp in acidity, leaving behind a clean, fruity finish.",87,16.0,Pinot Blanc,False,None,"['cocktail sipper', 'fruit', 'spice', 'oaky vanilla', 'dry', 'crisp acidity', 'clean finish', 'fruity finish']"
Italy,"From the Gravina appellation in Puglia (southern Italy), this charming blend of Greco (60%) and Malvasia (40%) opens with easy aromas of pear, Golden Delicious apple and drying mineral or talc powder. It's tonic and fresh in the mouth and would pair with tomato bruschetta and fresh basil.",86,10.0,White Blend,True,Italy,"['Gravina', 'Puglia', 'Greco', 'Malvasia', 'pear', 'Golden Delicious apple', 'mineral', 'talc powder', 'tonic', 'fresh', 'tomato bruschetta', 'fresh basil']"
France,"A powerfully ripe, toasty wine, showing all the richness of 2005 in Chablis, and adding a layer of structure to go with the apples and cream richness. At the center, there is green minerality.",92,88.0,Chardonnay,True,France,"['powerfully ripe', 'toasty', 'richness', '2005', 'Chablis', 'structure', 'apples', 'cream', 'green minerality']"
US,"Dry and savory, this blend of Grenache Blanc, Roussanne and Viognier has a tangy spine of minerality that frames lusher notes of papaya, white peach, lemon zest, nectarine and vanilla. Finishes with a refreshing touch of citrusy acids.",86,24.0,Rhône-style White Blend,False,None,"['Dry', 'savory', 'Grenache Blanc', 'Roussanne', 'Viognier', 'minerality', 'papaya', 'white peach', 'lemon zest', 'nectarine', 'vanilla', 'citrusy acids']"
France,"This is a light, fresh and fruity wine, with an attractive red-berry flavor, plus acidity and a soft structure.",84,24.0,Bordeaux-style Red Blend,False,None,"['light', 'fresh', 'fruity', 'red-berry flavor', 'acidity', 'soft structure']"
US,"Smells and tastes not quite ripe. Now that the wine is softening and resolving at the age of 3-1/2 years, it's showing a streak of veggie green behind the cherries.",83,34.0,Syrah,False,None,"['smells', 'tastes', 'not quite ripe', 'softening', 'resolving', 'age', 'streak', 'veggie green', 'cherries']"
US,"Always a very dry, elegant Pinot Noir, Signorello's '08 Las Amigas again displays those qualities. It shows dried raspberry, cherry and cola flavors, with a distinct minerality and a dusting of tobacco and black pepper. This fancy Pinot is a natural lamb or steak.",92,50.0,Pinot Noir,True,US,"['dry', 'elegant', 'Pinot Noir', 'dried raspberry', 'cherry', 'cola flavors', 'minerality', 'tobacco', 'black pepper', 'lamb', 'steak']"
US,"Cola, cherry, mocha and vanilla flavors, in a light-bodied, silky wine, with pronounced acidity. Finishes dry. A bit rustic, but offers good Pinot character.",85,24.0,Pinot Noir,False,None,"['cola', 'cherry', 'mocha', 'vanilla', 'light-bodied', 'silky', 'pronounced acidity', 'finishes dry', 'rustic', 'good Pinot character']"
Italy,"Paleo (a pure expression of Cabernet Franc from Coastal Tuscany) is a drop dead gorgeous wine with amazing intensity and purity of aromas. You get it all here: Bright berry notes, drying mineral, exotic spice, cooling acidity and firm, satisfying structure. It's a rich, velvety and beautiful wine that will award you a memorable drinking experience now or in 10 years time.",98,125.0,Cabernet Franc,True,Italy,"['Paleo', 'Cabernet Franc', 'Coastal Tuscany', 'intensity', 'purity', 'aromas', 'bright berry notes', 'drying mineral', 'exotic spice', 'cooling acidity', 'firm structure', 'rich', 'velvety', 'memorable drinking experience']"
France,"Oxidative and spicy. Effusive mineral notes provide complexity but turn heavy in the mouth without fruit for balance. Crisp, with a silky texture and a short-to-medium finish.",87,40.0,Alsace white blend,False,None,"['oxidative', 'spicy', 'mineral notes', 'complexity', 'heavy', 'mouthfeel', 'no fruit', 'balance', 'crisp', 'silky texture', 'short-to-medium finish']"
US,"This is a dry Chardonnay marked by pronounced acids and steely minerals. The underlying flavors are of exotic pineapples and guavas, while new oak and lees aging add richer notes of buttered toast and sour cream. Drink now.",90,30.0,Chardonnay,False,None,"['dry Chardonnay', 'pronounced acids', 'steely minerals', 'exotic pineapples', 'guavas', 'new oak', 'lees aging', 'buttered toast', 'sour cream', 'Drink now']"
Italy,"Here's a bright Friulano with a luminous golden color and intense aromas of honey, peach and passion fruit. The wine tastes soft and supple in the mouth and delivers loads of fruity peach flavors on the close. What's nice about this wine is that it delivers high structure and lively fruit fragrances at the same time.",88,18.0,Friulano,True,Italy,"['Friulano', 'golden color', 'aromas', 'honey', 'peach', 'passion fruit', 'soft', 'supple', 'fruity', 'high structure', 'lively fruit fragrances']"
Italy,"Oak dominates the overall character of this wine, with forward notes of toasted wood, tobacco leaf, roasted coffee bean and a hint of plum. There's more wood than fruit here.",85,20.0,Red Blend,False,None,"['oak', 'toasted wood', 'tobacco leaf', 'roasted coffee bean', 'plum', 'wood', 'fruit']"
US,"Simple and direct, with minty flavors of blackberries, licorice, cola, peppercorns and vanilla. On the plus side, the wine is fully dry, the tannins smooth.",84,8.0,Cabernet Sauvignon,False,None,"['minty flavors', 'blackberries', 'licorice', 'cola', 'peppercorns', 'vanilla', 'fully dry', 'smooth tannins']"
US,"This is a good price for a Cab so rich and supple. It's very deep in flavor, with flavors of blackberry pie filling, milk chocolate, anise and sweet oak, yet it's softly balanced and dry. Just delicious for drinking now.",90,30.0,Cabernet Sauvignon,False,None,"['Cab', 'rich', 'supple', 'deep flavor', 'blackberry pie filling', 'milk chocolate', 'anise', 'sweet oak', 'softly balanced', 'dry', 'delicious', 'drinking now']"
US,"This is a soft, broadly fruity Chardonnay, with near-tropical ripeness. Banana and papaya flavors dominate, accented by pretty baking spices and a touch of mineral.",88,32.0,Chardonnay,False,None,"['soft', 'broadly fruity', 'Chardonnay', 'tropical ripeness', 'banana', 'papaya', 'baking spices', 'mineral']"
France,"Somebody was carried away with wood here. The wine is totally dominated by flavors of burnt wood— even the 50% new wood was too much in 2007. That said, the fruit could increase in weight and black berry flavors. But not just yet—in another three to four years.",88,24.0,Malbec,False,None,"['wood', 'burnt wood', '50% new wood', '2007', 'fruit', 'weight', 'black berry flavors', 'three to four years']"
Italy,"Le Focaie is a great value wine with easy but one-dimensional fruit characteristics of cherry, blackberry and cinnamon spice. The wine's natural thickness and consistency recalls the sunniest vineyards of southern Tuscany.",87,15.0,Sangiovese,True,Italy,"['great value', 'one-dimensional', 'fruit characteristics', 'cherry', 'blackberry', 'cinnamon spice', 'natural thickness', 'consistency', 'sunniest vineyards', 'southern Tuscany']"
US,"There's a wild, feral quality to this fine Pinot Noir. It has forest flavors of wild mushrooms, thyme, fennel, anise and pine, along with more familiar flavors of red cherries, cola and sandalwood. Elegant and ageable. Now through 2012.",94,75.0,Pinot Noir,False,None,"['wild', 'feral', 'Pinot Noir', 'forest flavors', 'wild mushrooms', 'thyme', 'fennel', 'anise', 'pine', 'red cherries', 'cola', 'sandalwood', 'elegant', 'ageable', '2012']"
US,"Crushed stone and dried clay notes lend a distinctly earthen character to this dry light-bodied Riesling. Pressed apple and pear flavors on the palate are freshened by squirts of lime, lemon and a tart green-plum finish. The finish is long and lingering.",87,15.0,Riesling,False,None,"['crushed stone', 'dried clay', 'earthen character', 'dry', 'light-bodied', 'Riesling', 'pressed apple', 'pear flavors', 'freshened', 'lime', 'lemon', 'tart green-plum finish', 'long', 'lingering']"
France,"The weight of the structure is almost overpowering for the fresh blackberry fruits in the wine. Its presence is big, powerful, with bitter fruits and black figs, finishing with a final punch of richness.",86,20.0,Bordeaux-style Red Blend,False,None,"['weight', 'structure', 'fresh blackberry', 'big', 'powerful', 'bitter fruits', 'black figs', 'richness']"
US,"Quite a distinguished '99, with its flamboyant aromas of spicy blackcurrants and cassis, with an oaky overlay of smoke and vanilla. Feels good as soon as it hits the palate, with blackberry flavors that last through the finish. The jolt of dry tannins that makes the palate puckery suggests midterm aging.",90,38.0,Cabernet Sauvignon,False,None,"['distinguished', '1999', 'flamboyant aromas', 'spicy blackcurrants', 'cassis', 'oaky overlay', 'smoke', 'vanilla', 'blackberry flavors', 'dry tannins', 'midterm aging']"
US,"This gets an extra year in barrel and bottle prior to release. It's two-thirds Cabernet Sauvignon, 28% Syrah and 5% Petit Verdot. Still tart and tannic, the wine carries a full load of herb and earth characteristics, with less impact from the fruit than the high alcohol would suggest.",89,50.0,Red Blend,False,None,"['extra year', 'barrel', 'bottle', 'Cabernet Sauvignon', 'Syrah', 'Petit Verdot', 'tart', 'tannic', 'herb', 'earth', 'high alcohol']"
US,"Unfortunately only available in Bermuda, this wonderful bottling shows salted brambleberries, crushed violets, asphalt, rosemary and pinpointed florality on the fresh yet concentrated nose. The palate is zesty and darkly focused, with elderberries, stewed plums, thyme and Earl Grey tea. It's quite a complex effort.",94,34.0,Pinot Noir,True,None,"['salted brambleberries', 'crushed violets', 'asphalt', 'rosemary', 'florality', 'zesty', 'darkly focused', 'elderberries', 'stewed plums', 'thyme', 'Earl Grey tea', 'complex']"
US,"This captivating wine treads the line between Rhône and Bordeaux. A splash of Cabernet, though just a fraction of the blend, stands out. The wine has depth and persistence, and the mix of grapes works well, showing brambly red fruits, like a Zin, spice and pepper, like Syrah, and some herbal and leafy tobacco in the finish. Complex, unique and quite appealing.",91,45.0,Red Blend,False,None,"['captivating wine', 'Rhône', 'Bordeaux', 'Cabernet', 'depth', 'persistence', 'brambly red fruits', 'Zin', 'spice', 'pepper', 'Syrah', 'herbal', 'leafy tobacco', 'finish', 'complex', 'unique', 'appealing']"
Italy,"This no-fuss blend of Chardonnay and Fiano offers simple tones of citrus and pear that segue to a crisp, clean mouthfeel. Pair this fresh southern Italian white with insalata di mare (seafood salad).",86,29.0,White Blend,True,Italy,"['blend', 'Chardonnay', 'Fiano', 'citrus', 'pear', 'crisp', 'clean', 'mouthfeel', 'fresh', 'southern Italian', 'insalata di mare', 'seafood salad']"
France,"Medium intense notes of sweet grass, fresh red apple slices, green melon and lime citrus on the nose and mouth. Medium weight with moderate, supporting acidity and a clean finish. Drink now.",86,10.0,White Blend,False,None,"['medium intense', 'sweet grass', 'fresh red apple slices', 'green melon', 'lime citrus', 'medium weight', 'moderate acidity', 'clean finish', 'drink now']"
US,"This pure Cabernet Sauvignon is not a heavy wine, but within its sleek profile are interesting flavors of berry, leaf and earth. Tannins are crisp and proportionate, and the fruit carries through a graceful, moderately long finish.",87,36.0,Red Blend,False,None,"['Cabernet Sauvignon', 'berry', 'leaf', 'earth', 'tannins', 'crisp', 'proportionate', 'fruit', 'graceful', 'moderately long finish']"
Spain,"Aromas of chocolate mint, creamy vanilla and candy reflect a heavy-handed oak treatment, and a sweet burnt cherry and chocolate mint character is present throughout. Creamy on the tongue, but confected in terms of flavors and finish.",84,18.0,Tempranillo,False,None,"['chocolate mint', 'creamy vanilla', 'candy', 'oak treatment', 'sweet burnt cherry', 'creamy', 'confected', 'flavors', 'finish']"
US,"Ripe and fleshy in young fruit, this Cab, with minor amounts of Cab Franc and Merlot, shows black currant, plum, cherry and cedar flavors, with a dry-sweet dusting of crushed brown herbs and spices. Fairly tannic and tight now, it's balanced enough for mid-term aging. Best 2008–2012.",89,95.0,Cabernet Sauvignon,False,None,"['Ripe', 'fleshy', 'Cab', 'Cab Franc', 'Merlot', 'black currant', 'plum', 'cherry', 'cedar', 'dry-sweet', 'crushed brown herbs', 'spices', 'tannic', 'tight', 'balanced', 'mid-term aging', 'Best 2008–2012']"
Spain,"After an early blast of gaseous sulfur, this heavyweight Tempranillo smells of toasted oak, graphite, latex and alcohol. The palate is lush, meaty, jammy and borderline syrupy, while flavors of blackberry, fig and chocolate finish with depth and extreme richness. Drink through 2025.",92,100.0,Tempranillo,False,None,"['Tempranillo', 'toasted oak', 'graphite', 'latex', 'alcohol', 'lush', 'meaty', 'jammy', 'syrupy', 'blackberry', 'fig', 'chocolate', 'depth', 'richness', 'drink through 2025']"
Italy,"Terre di Maria is a Sicilian blend of Cabernet Sauvignon, Merlot, Syrah and Pinot Noir that opens with dark concentration and savory aromas of spice, cured meat, smoked bacon and dark berry fruit. The bouquet is slightly muddled but the mouthfeel is bright and fresh.",87,27.0,Red Blend,True,Italy,"['Sicilian', 'blend', 'Cabernet Sauvignon', 'Merlot', 'Syrah', 'Pinot Noir', 'dark concentration', 'savory aromas', 'spice', 'cured meat', 'smoked bacon', 'dark berry fruit', 'bouquet', 'mouthfeel', 'bright', 'fresh']"
US,"Intricate aromas and spicy, complex flavors make this medium-bodied wine an adventure to drink. It smells like cherries and cloves and wood smoke, tastes nicely ripe but dry, and has an appetizing, tannic grip in the texture.",89,16.0,Barbera,False,None,"['intricate aromas', 'spicy flavors', 'medium-bodied', 'cherries', 'cloves', 'wood smoke', 'ripe', 'dry', 'tannic grip', 'texture']"
US,"Eric Hamacher has done a fine job with this wine. At 13.6% alcohol it is in fine balance, with a precise mix of strawberry, pie cherry, root beer and herb flavors. It's medium bodied, open and accessible, but not too simple. There is no reason to wait, but it could be cellared for up to six years.",90,45.0,Pinot Noir,False,None,"['Eric Hamacher', '13.6% alcohol', 'balance', 'strawberry', 'pie cherry', 'root beer', 'herb flavors', 'medium bodied', 'open', 'accessible', 'not too simple', 'cellared', 'six years']"
US,"A little sharp and minty, this Pinot is very dry, with acidic flavors of cherries and cola. The mouthfeel is silky. It's not going anywhere, so drink up.",84,48.0,Pinot Noir,False,None,"['sharp', 'minty', 'dry', 'acidic', 'cherries', 'cola', 'silky', 'drink up']"
US,"Hot in high alcohol, which gives a burn that accentuates the pepper spice and makes it fierce. Yet it's fully dry and rich in blackberry, blueberry, anise and tobacco flavors. Defines the California superripe Zinfandel style.",87,22.0,Zinfandel,True,US,"['high alcohol', 'burn', 'pepper spice', 'fierce', 'fully dry', 'rich', 'blackberry', 'blueberry', 'anise', 'tobacco', 'California', 'superripe', 'Zinfandel']"
France,"This firm, dry wine is all tannins and bitter extraction. It has a hard side to it that the juicy fruit cannot balance.",82,20.0,Bordeaux-style Red Blend,False,None,"['firm', 'dry', 'tannins', 'bitter extraction', 'hard side', 'juicy fruit', 'balance']"
US,"Soft and round, with an explosive burst of candied fruit on the palate, this Barbera has concentrated flavors of dried cherry, plum and milk chocolate, the latter of which pops on the finish.",86,24.0,Barbera,True,Italy,"['soft', 'round', 'explosive', 'candied fruit', 'concentrated flavors', 'dried cherry', 'plum', 'milk chocolate', 'finish']"
France,"Produced only in top years, this rich wine is impressive. It has great fruit, ripe strawberries and red currants bringing juicy fruitiness. There is also a more serious mineral texture that comes with tangy acidity. Age this wine for a few more months and drink from the end of 2017.",92,17.0,Rosé,False,None,"['rich wine', 'great fruit', 'ripe strawberries', 'red currants', 'juicy fruitiness', 'mineral texture', 'tangy acidity', 'age this wine', 'drink from the end of 2017']"
US,"A rustic wine with strong, edgy tannins and modest cherry and coffee flavors. It's very dry and astringent, but will soften with beef.",85,24.0,Syrah,False,None,"['rustic', 'strong tannins', 'edgy tannins', 'modest cherry flavors', 'modest coffee flavors', 'very dry', 'astringent', 'soften with beef']"
US,"Ripe and generously oaked on the palate, this Chardonnay has flavors of pineapple jam, buttered toast and buttered popcorn. It's brightened with crisp acidity.",85,26.0,Chardonnay,False,None,"['Ripe', 'generously oaked', 'Chardonnay', 'flavors', 'pineapple jam', 'buttered toast', 'buttered popcorn', 'brightened', 'crisp acidity']"
Italy,"Dark berry, truffle, toast and kitchen spice aromas meld in the glass. On the palate, notes of roasted coffee bean, powdered sage and ground pepper accent a core of dried black cherry while assertive tannins provide the framework. It ends on an astringent note.",87,19.0,Red Blend,False,None,"['dark berry', 'truffle', 'toast', 'kitchen spice', 'roasted coffee bean', 'powdered sage', 'ground pepper', 'dried black cherry', 'assertive tannins', 'astringent note']"
US,"Earthy, spicy aromas lead, rolling into smoky layers of typical Cab flavors. Berry, tobacco and touches of sweet oak give it okay complexity.",83,16.0,Cabernet Sauvignon,False,None,"['earthy', 'spicy', 'smoky', 'Cab flavors', 'berry', 'tobacco', 'sweet oak', 'complexity']"
Italy,Rubesco Riserva is a dark and sophisticated wine (a 70-30 blend of Sangiovese and Canajolo) with big aromas of red fruit and exotic spice. This vintage (2003 was an exceptionally hot year) shows extra ripeness on the fruit and a touch of bitterness on the close.,89,55.0,Red Blend,True,Italy,"['Rubesco Riserva', 'Sangiovese', 'Canajolo', 'dark', 'sophisticated', 'aromas', 'red fruit', 'exotic spice', '2003', 'hot year', 'ripeness', 'bitterness']"
France,"Toasty, with notes of slightly menthol-like oak layered over ripe blackberry fruit. It's a medium-bodied wine that finishes crisp, tart and mouthwatering. Give it another 6–12 months to better integrate the oak, then drink it over the next five or so years.",87,16.0,Malbec-Merlot,False,None,"['toasty', 'menthol-like oak', 'ripe blackberry fruit', 'medium-bodied', 'crisp', 'tart', 'mouthwatering', 'integrate the oak', 'drink', 'five years']"
France,"Generous and opulent, this is a wood-aged wine in which the fruit plays a delicious part. Blackberry juice and acidity play counterpoint to toasty wood flavors and dark tannins. There is a fine, toasty aftertaste that promises good aging. Drink from 2015.",91,20.0,Bordeaux-style Red Blend,False,None,"['wood-aged', 'fruit', 'blackberry juice', 'acidity', 'toasty wood flavors', 'dark tannins', 'toasty aftertaste', 'good aging', 'Drink from 2015']"
France,"This Clerc-Milon, under the same winemaking team as Mouton Rothschild, is an attractive wine, not heavy, already quite soft. It seems to have been heavily extracted, in a New World style, with new wood aromas and flavors, losing something of Pauillac, but a winner in that it's immediately attractive. Imported by Diageo Chateau & Estates.",89,55.0,Bordeaux-style Red Blend,True,France,"['Clerc-Milon', 'Mouton Rothschild', 'attractive wine', 'not heavy', 'soft', 'heavily extracted', 'New World style', 'new wood aromas', 'Pauillac', 'immediately attractive', 'Diageo Chateau & Estates']"
Italy,"This opens with aromas of dark berry, toast, espresso and a whiff of dark cooking spice. The bracing palate offers unripe cherry, licorice, powdered sage and toasted oak alongside bracing tannins that leave an astringent, mouth-puckering finish.",87,29.0,Nebbiolo,False,None,"['dark berry', 'toast', 'espresso', 'dark cooking spice', 'unripe cherry', 'licorice', 'powdered sage', 'toasted oak', 'bracing tannins', 'astringent', 'mouth-puckering finish']"
US,"With this wine, Venge has taken a giant leap into the front ranks of California Syrah producers. It's made from fruit that's sourced from the great Stagecoach Vineyard, which straddles Atlas Peak—a cool mountain region. The acidity is preserved, and the concentrated fruit easily handles the 60% new French oak. Dramatic and high in alcohol, this selection is gorgeous to drink now, and it will remain fresh over the next six years.",94,54.0,Syrah,True,US,"['Venge', 'California', 'Syrah', 'Stagecoach Vineyard', 'Atlas Peak', 'cool mountain region', 'acidity', 'concentrated fruit', '60% new French oak', 'dramatic', 'high alcohol', 'gorgeous', 'fresh', 'six years']"
France,"Ripe, open and packed with melon and tropical fruit flavors, this wine is already showing enticing drinkability. Its fresh, ripe fruits is layered with some mineral character and an under-cushion of wood.",90,65.0,Chardonnay,False,None,"['ripe', 'melon', 'tropical fruit', 'drinkability', 'fresh', 'mineral character', 'wood']"
US,"A dark, rich, ripe Syrah that defines the California style, and preserves the fine structure that this cool-climate region lends to red wines. The wine is dry and tannic, and the flavors, of blackberries, cherries, blueberries, dark chocolate and sweet, smoky oak, are just delicious. Now and for a few years.",92,27.0,Syrah,True,US,"['dark', 'rich', 'ripe', 'Syrah', 'California style', 'fine structure', 'cool-climate', 'dry', 'tannic', 'blackberries', 'cherries', 'blueberries', 'dark chocolate', 'sweet', 'smoky oak', 'delicious']"
US,"Brander has struggled with Merlot. This year's bottling achieve plenty of cherry-berry and mocha fruit. The challenge continues to be the tannic structure, but improvement is notable.",87,20.0,Merlot,False,None,"['Brander', 'Merlot', 'cherry-berry', 'mocha', 'tannic structure', 'improvement']"
France,Excellent color on this firmly fruity wine. It has an attractive edge of tannins giving it good structure while showing all of the fresh nouveau fruit.,86,12.0,Gamay,False,None,"['excellent color', 'firmly fruity', 'attractive edge of tannins', 'good structure', 'fresh nouveau fruit']"
Italy,Cantina Tre Serre is a well-priced and informal Barbera with a thin and informal style backed by fruity freshness. There's even a tiny touch of effervescence that adds a perky and peppery sensation to the mouthfeel.,84,11.0,Barbera,True,Italy,"['Cantina Tre Serre', 'Barbera', 'well-priced', 'informal style', 'fruity freshness', 'effervescence', 'perky', 'peppery', 'mouthfeel']"
France,"This solidly structured wine shows the firm tannins and mineral structure typical of wines from Côte du Py. It has dense black cherry fruits along with sacidity that cuts through the structure. It could age another year, but is worth drinking now.",91,24.0,Gamay,True,France,"['solidly structured', 'firm tannins', 'mineral structure', 'Côte du Py', 'dense black cherry fruits', 'acidity', 'age', 'drinking now']"
US,"Each year this value red blend is surprisingly different. With Syrah as the main component, it's spicier, more sappy and loaded with bright and forward berry flavors. The Bordeaux grapes that fill in the second half of the blend add notes of herb, earth, leaf and a hint of stone. It's a delicious, fine value.",88,15.0,Red Blend,False,None,"['value red blend', 'Syrah', 'spicy', 'sappy', 'bright berry flavors', 'Bordeaux grapes', 'herb', 'earth', 'leaf', 'stone', 'delicious', 'fine value']"
