country,points,price,variety,country_from_location,keywords
3,0.3544983762587686,-0.25730335459015136,39,,dark sweet candied nose raisin licorice saturated monotone single-leveled flavor sweet black cherry short finish very nice Allende
0,-1.1300006868013983,-0.6067104086234912,17,0.0,Ste. Michelle Merlot overripe fruit raisined fruit tobacco black licorice soft midpalate bitterness finishing tannins
1,-2.0207001246374983,-0.921176757253497,37,,dilute grapey flavors candied charred lumber wood-and-juice quaff
0,0.9482980014828354,-0.29224405999348535,45,,Zinfandel soft appealing fine balance dry rich cherry currant Provençal herb spice tobacco complexity
0,-1.723800312025465,-0.5717697032201572,45,,hot unbalanced fruit raisins mint bone dry rustic rugged tannins coarse finish
0,-0.5362010615773315,-0.7814139356401612,32,0.0,Amador Foothill Sangiovese dry rosé brisk acidity cherry rose petal lavender bouillabaisse
0,-1.1300006868013983,-0.36212547080015334,2,,oak carpenter's shop charred sugar dark stone fruit cranberry sauce soft syrupy tannic traction raw meat blackberry juicy finish
3,2.4327970645430024,4.075344115423262,39,,"dark meaty plum beef jerky huge palate pure fruit tannin chocolate finish classic balance complexity less than 400 cases imported by Tempranillo, Inc."
1,0.057598563646735254,0.4764514588798623,25,,tannins red plums light elegant acidity fresh fruit
0,0.651398188870802,-0.32718476539681934,45,0.0,Dry Creek Valley Zinfandel dry briary brambly wild berry cola crisped bacon spicy black pepper white pepper nutmeg anise clove silky gently tannic alcohol 13.7% warm
3,-1.4269004994134318,-0.8862360518501631,20,,Airén big-crop white grape distilled brandy Sherry dry white table wine cleansing lime kiwi flavors decent
0,0.057598563646735254,1.280087683156544,25,,tough astringent crunchy dry tannins acidity fine vineyards so-so vintage core cherries red currants cola develop six years
1,0.9482980014828354,1.8391389696098877,37,,spice blackcurrant solid tannins powerful wood flavors spectacular polished style rustic wines 90-year old vines 70% new wood 18 months
0,-2.3175999372495317,-0.46694758701015526,37,,simple hot sweet-and-sour not a success
0,-1.723800312025465,-0.7115325248334932,7,,thin peach pear caramelly toasty oak
0,0.651398188870802,2.1536053182398933,25,0.0,oak Pinot Noir vanilla cream toasted meringue baked Alaska ripe raspberries cherries Santa Rita
3,0.651398188870802,-0.5717697032201572,0,,Aromas white flowers stone fruits lees well-made Albariño juicy elegant palate citrus stone-fruit flavors lasting pithy character finish
0,-1.1300006868013983,-0.5368289978168233,5,,toasty cedar menthol red berries licorice delicate tart finish lemony
0,0.057598563646735254,-0.22236264918681736,37,,Syrah soft slightly sweet blackberry cherry jam milk chocolate anise tangerine rind drink now
0,0.651398188870802,0.057162994039854496,25,,elegant restrained lovely Pinot Noir vintage soft round cherry fruit sandalwood mocha fully ripe fine tannins integration barrel notes
2,0.057598563646735254,-0.46694758701015526,37,,D'Alessandro plump Syrah bold generous red wine richly layered aromas cherry blackberry rum cake bacon fat toasted nut pair abbacchio arrosto roast lamb
0,-1.1300006868013983,-0.6416511140268252,39,,rich cherry blackberry cola smoked meat dry crisp silky funkiness one-dimensional simplicity
2,-0.23930124896529814,-0.46694758701015526,32,,espresso leather black plum mouthfeel full balanced acidity dry long finish tar licorice bitter chocolate tannins solid fruit lavish toast
0,-1.4269004994134318,-0.8512953464468291,7,,soft simple candied peach pear flavors oaky leesy influence fancier
0,-0.833100874189365,-0.7464732302368271,27,,dry fruity polished cherry cassis flavors harsh minty easy to like pizza burgers enchiladas
0,-1.4269004994134318,-0.29224405999348535,37,,barely ripe thin herbal vegetal flavors sour streak barrel aging vanilla licorice
0,1.5420976267069022,0.7559771021065341,5,,Cabernet dry tannic acidity blackberry cherry oak umami smoke Drink now-2016
0,0.651398188870802,-0.1874219437834834,7,0.0,Fogarty 2005 Chardonnay crispness minerality single-vineyard elegant angularity succulent pineapples kiwis new oak brisk acidity vibrantly clean
0,-2.3175999372495317,-0.3970661762034873,21,,blackberry oak vegetable flavors distracting
0,-1.1300006868013983,-0.6416511140268252,45,,easy to drink soft silky ripe berry flavors cherry flavors Asian spiciness dry balanced
2,1.2451978140948687,-0.11754053297681542,44,,Hekate amber-gold color lively aromas stone fruit apricot honey caramel almond paste yellow rose thick sticky deliciously sweet
0,0.651398188870802,0.5812735750898642,2,1.0,Bordeaux Cabernet Sauvignon primary fruit blackberries black cherries plums carob cola tannins mouthfeel dryness young fresh charm ageability decanting 2013
0,-1.723800312025465,-0.04765912217014746,45,,Zinfandel hot Port-like clumsy overripe blackberry raisin chocolate flavors tasty
0,-1.1300006868013983,0.23186652105652442,3,,fruity soft candied high alcohol blackberry cherry pie filling flavors rustic texture Cabernet Sauvignon Syrah varieties
2,0.9482980014828354,0.7909178075098682,18,,lively plush ripe blackberry leather tobacco cola cigar box bold soft velvety cellar five years
0,-2.0207001246374983,-0.1874219437834834,9,,mocha raspberry carob tart rustic tannins char vanilla finish
0,-0.23930124896529814,0.5113921642831963,27,,cherry berry herb tannins dry smoothly textured cellar
0,0.057598563646735254,-0.29224405999348535,25,0.0,Pinot coastal influence dry silky ripe cherries Dr. Pepper cola red licorice sandalwood cinnamon pepper drink now
1,0.057598563646735254,-0.5717697032201572,28,,medium-intense scents dark berries black plum bouquet soft hints vanilla toast garrigue mouthfeel robust gripping skin-driven fruit flavors solid tannins finish
1,0.3544983762587686,1.6294947371898838,7,1.0,big fat Meursault depth of flavor ripe Chardonnay
2,-0.23930124896529814,-0.5368289978168233,1,2.0,Barbera d'Asti Superiore fresh fruit layers vibrant tones cherry cranberry pomegranate easy-pairing cleansing acidity medium density polished finish
0,0.9482980014828354,0.16198511024985646,5,0.0,Red Mountain Cabernet Sauvignon wild berry cassis bright acids tamed tannins cherry flavors concentrated beautifully proportioned accessible ageworthy medium term
0,1.5420976267069022,-0.29224405999348535,21,0.0,Parducci True Grit dry tannic rich blackberry cherry currant leather coffee carob peppery spice finish age Petite Sirah
3,-0.833100874189365,-0.7814139356401612,39,,dry woodsy balsam black cherry crisp lean drink now
2,0.3544983762587686,0.7559771021065341,20,2.0,full generous red wine Umbria aged 18 months casks small barrel bottle release soften tannins Sagrantino grape firm structure cherry spice bold super-ripe raspberry
0,-0.5362010615773315,-0.11754053297681542,2,1.0,Cabernet Sauvignon Bordeaux blend drinking now blackberry cherry oak flavors finishes sweet
0,-0.23930124896529814,-0.5018882924134892,25,,pleasant light cherry-flavored barrel flavors French oak tannins backbone
0,0.3544983762587686,0.3017479318631924,20,0.0,California southern Rhône-style blend smooth pleasant rich flavors cherry cherry liqueur cola mocha bacon white pepper Drink now
0,-1.723800312025465,-0.5368289978168233,3,,Cab-Sangiovese blend awkward clean fruity sugary sweet dry table wine
1,0.9482980014828354,-0.22236264918681736,20,,creamy nuttiness nose sunniness 2015 mirabelle ripeness slight subtle graceful texture lemon freshness finish
2,-1.723800312025465,-0.7814139356401612,31,,bright pink rosé berry aromas floral aromas chemical point awkward first impression bright firm crisp
2,0.057598563646735254,0.5463328696865303,18,2.0,Serralunga d'Alba black cherry espresso prune subtle oak tire rubber young aggressive tannins dry finish
2,0.9482980014828354,-0.29224405999348535,27,,Cabernet Sauvignon Syrah black fruit rum cake licorice tobacco spice ripe fruit cassis elegant complex
1,-0.23930124896529814,-0.7115325248334932,44,1.0,Gascony Gros Manseng herbal character yellow fruits honey crisp green-fruit flavors Drink now
0,0.057598563646735254,-0.46694758701015526,27,,Firehouse Red Tamarack Cabernet Syrah Merlot Franc Malbec spicy high-toned fruit bright herbal tart red fruit nettles wild herbs complexity mutt wine
0,-0.23930124896529814,-0.5717697032201572,9,,tart young spicy red cranberry chilled wine punch
0,-1.1300006868013983,0.3017479318631924,25,,heavy dull darkest ripest softest plummiest oak Grenache vibrancy lift Pinot Noir
0,0.9482980014828354,-0.1874219437834834,7,,tropical fruits Meyer lemons limes peaches Chardonnay French oak buttered toast crisp acidity clean finish
0,-0.5362010615773315,-0.29224405999348535,7,,warm spice oak tones fresh apples lemons full-bodied Chardonnay dense slick of caramel midpalate lemon-lime acidity finish levity
1,0.651398188870802,-0.6416511140268252,20,,ripe pink grapefruit minerality richness taut tannins citrus aftertaste
0,-2.3175999372495317,-0.6416511140268252,43,,sweet medicinal sugary apricot orange soda flavors deficient acidity
3,0.057598563646735254,-0.22236264918681736,0,3.0,lemon lime tropical fruit green apple good acidity fresh dry Albariño
0,-0.833100874189365,0.16198511024985646,5,,Cabs venerable winery cool vintage burnt edge blackberry pie filling tannins astringent shut down the palate show better after 2008
2,-0.23930124896529814,-0.7115325248334932,27,2.0,Lazio Montepulciano Merlot blend rich penetrating black fruit spice well-priced enological potential
0,0.3544983762587686,-0.6765918194301591,31,,dry succulent tangy flavors rhubarb raspberry picnic foods fried chicken summer sipper
0,-0.23930124896529814,1.6294947371898838,2,,oaky jammy cherries raspberries sweet fruit pastry baked crust one-dimensional delicious Cabernet Sauvignon Petit Verdot Cabernet Franc Malbec
3,0.3544983762587686,-0.5018882924134892,20,3.0,Muruve Toro reserva coconut black plum ripe structured black fruit coffee vanilla finish now next few years
0,0.3544983762587686,-0.46694758701015526,43,,Dusty detailed pure Viognier notes of lemon-pepper tart fresh lemon pulp lemon rind hint of curry powder accompaniment raw clams oysters
0,1.5420976267069022,0.5812735750898642,2,,blend Cabernet Sauvignon Merlot Cabernet Franc complex old-vine herb tobacco olive brambly berries drink now–2020
0,-0.23930124896529814,0.057162994039854496,44,,dessert wine Ain Muscat Viognier sweet apricot tangerine peach honey dusty spice flavors concentrated
1,1.8389974393189357,0.930680629123204,2,1.0,Lynch-Bages rich polished 2003 Jean-Michel Cazes Daniel Lhose ripe opulent Napa fruit compact dense acidity Bordeaux Diageo Chateau & Estates
0,0.651398188870802,-0.11754053297681542,5,,2012 releases dense dark substantial Cassis black cherry char coffee firm ripe tannins length balance young vines
0,2.135897251930969,1.9439610858198897,5,,heavy-duty Cabernet rich black cherry cassis fruit dense dark tannins long finish grainy finish raw power perfect proportion differentiated 2010s winemaker Chris Figgins
1,-0.23930124896529814,-0.6416511140268252,28,,eucalyptus chocolate-covered cherries wild raspberries black cherry plum medium weight mouth moderate finish sweet oak
0,-1.1300006868013983,-0.11754053297681542,14,,Malbec dry tannic acidic blackberries tough wine decant barbecue
0,0.9482980014828354,0.19692581565319042,25,,light-bodied gentle intricate flavor nuances cranberry herb tea soothing tangy mulled cherry clove finish sip savor
0,0.651398188870802,-0.5717697032201572,22,,distinctive aromas beeswax bee pollen tart yellow apple fragrant ageworthy high-acid decanting
0,-0.5362010615773315,-0.29224405999348535,14,,blackberry black cherry vanilla tobacco oak treatment bitterness tannins fruit finish
0,-0.833100874189365,0.5812735750898642,17,0.0,unripe herb mint blackberry cassis Napa mountain tannins acids sharp finish not an ager
1,1.5420976267069022,0.33668863726652637,28,1.0,Grenache Syrah Mourvèdre Lirac big rich dark fruit meaty savoriness baking spices softly layered wood
3,0.3544983762587686,0.5463328696865303,39,,blackberry cola leather spicy wood black cherry plum intense closed finish better in three years
0,-0.833100874189365,0.23186652105652442,36,,sweet Pinot Noir Chardonnay blend jammy raspberry cherry vanilla smoke finish
0,0.3544983762587686,0.12704440484652246,37,0.0,Walla Walla Seven Hills vineyard Syrah fruit flavors citrus tart berries green tea tannins
0,0.057598563646735254,-0.32718476539681934,45,0.0,soft dense dark fruit baked fruit flavors nuts vanilla easy-drinking Zin Petite Sirah Lodi producer
0,1.2451978140948687,0.057162994039854496,28,,Syrah Grenache Mourvèdre Viognier red cherries red currants red licorice dry full bodied tannic astringency crushed red pepper lovely complex decant
2,-0.23930124896529814,-0.5368289978168233,31,,bouquet raspberry rose wild berry bitter almond sassy crispness finish pair cheese mayonnaise-based appetizers
1,-0.23930124896529814,-0.7464732302368271,2,,soft ripe fruity attractive ready-to-drink juicy red fruits balanced tannins dry contrast finish dark structured potential for aging
2,-0.5362010615773315,-0.6416511140268252,1,,light-bodied lacking in tannin traditional Barbera mixed berry fruit forest floor graham cracker drink now
0,0.9482980014828354,0.7559771021065341,27,,Bordeaux blend Cabernet Sauvignon Merlot blackberry cherry cassis oak spice tannic astringency cellar better after 2014
3,-0.5362010615773315,-0.5717697032201572,20,3.0,Montsant white oily oaky nose Garnacha Blanca plump decent acidity full flavors papaya melon finishes oily green notes scallion flavors 500 cases made
3,-0.833100874189365,-0.11754053297681542,36,,crisp white-fruit aromas green grass briny lime tart apple flavors
2,1.5420976267069022,3.7259370613899225,8,,sophistication aromas spice candied fruit licorice maple syrup aged bright future mouthfeel tight polished firm tannins integrity of fruit
0,-0.23930124896529814,-0.6067104086234912,37,,rich textured Syrah cherry black raspberry chocolate anise pepper sandalwood smooth tannins soft fruity
0,-0.23930124896529814,0.40657004807319436,7,,wet slate minerality brisk tightly wound nose perfumed crisp apple pear nectarine
2,0.3544983762587686,-0.5368289978168233,32,,sweet dark cherry plum fruit sulfur full mouthfeel lush dry finish decant wait a year or two
0,-0.833100874189365,-0.8163546410434951,5,,rustic dry Cabernet full-bodied blackberry currant cocoa licorice vanilla oak
0,-1.1300006868013983,-0.11754053297681542,25,,aging quickly raisins brown sugar soft tannins at peak drink up
0,-0.23930124896529814,-0.5368289978168233,7,,rich Chardonnay creamy smooth dry flavors citrus tropical fruit vanilla buttered toast brisk clean acidity
1,-0.833100874189365,-0.7814139356401612,20,1.0,wines southwest white Gascony blend crisp fruity soft texture ripe Colombard lively drink now
3,0.9482980014828354,-0.6765918194301591,20,,ultraconcentrated heavy nose syrupy brown sugar caramel flavor profile creamy chunky finish excellent dessert wine price
2,1.5420976267069022,0.7559771021065341,18,,gorgeous delicate bouquet pressed rose wet earth licorice cola dried berry fruit mouthfeel long silky
1,-1.1300006868013983,-0.3970661762034873,31,,soft fat caramel-flavored strawberry fruits creamy texture lacks acidity needs to be drunk soon
0,-0.5362010615773315,-0.29224405999348535,5,,dryness low alcohol hard tannins biting acidity blackberry sweet green-herb flavors ripe cult style unattractive
0,-0.23930124896529814,-0.5368289978168233,17,,dry elegant ready to drink steak complex Merlot black cherries licorice cola spices smoky oak
2,0.651398188870802,-0.04765912217014746,27,2.0,Rusciano blend Syrah Nero d'Avola depth complexity aromas dark fruit spice black currant earthy tobacco finish smooth rich
2,0.057598563646735254,-0.5717697032201572,1,,deep tart-sweet black-plum toasty oak modern-style Barbera native acidity food match tannic structure immediate appeal long finish dark handsome
1,1.2451978140948687,1.0704434507365401,25,1.0,generous rounded opulence Volnay tannic old vines rich fruit-filled dry core fragrant red berry acidity drink from 2018
0,-0.23930124896529814,0.02222228863652051,4,,aromas dried out fruit leather medicine cabinet green herbs palate advanced age
1,0.057598563646735254,-0.46694758701015526,31,,crisp fruity classic rosé lightness delicately handled fruits gentle berry flavors bright acidity textured aftertaste
0,-1.1300006868013983,-0.8163546410434951,35,,grassy gooseberry lemon lime acidity Semillon Chardonnay fruity clean sweet finishes swiftly
0,0.651398188870802,-0.1524812383801494,32,,tasty toasty red wine Sangiovese tangy red berry fruit peppery herbs smooth creamy mocha-infused finish
0,-0.23930124896529814,0.057162994039854496,25,0.0,ripe sweet jammy cherries raspberries cinnamon brown sugar cocoa dry crispness Arroyo Seco acidity drink now
0,-0.5362010615773315,-0.46694758701015526,17,,pretty wine aromas black-cherry liqueur espresso round full lushly flavored high acidity real bite finish bitter food
2,-1.4269004994134318,-0.8862360518501631,32,,Sangiovese pizza grilled ham and cheese sandwich mild fruit flavors sun-drenched aromas leather spice
0,0.651398188870802,-0.46694758701015526,37,,aromas muscle meat Syrahs concentrated palate brambly berry pepper sea salt cured meat loam
0,1.2451978140948687,-0.32718476539681934,30,,consistent style textural lemony racy Riesling bone dry residual sugar rich flavors grapefruit citrus nectarine pear sharp minerality
2,-0.23930124896529814,-0.29224405999348535,18,,earthy aromas scorched soil overripe plum leather farmyard game clove sage raw red cherry bracing tannins
0,0.651398188870802,-0.11754053297681542,20,,white wine honey-rich dry oaky Chardonnay tropical fruit vanilla flavors pleasant touch of bitterness
2,0.651398188870802,0.40657004807319436,1,2.0,bright fruit-forward Piedmont red wine aromas fresh fruit exotic spice drying mineral fresh acidic component jammy sweet finish
0,-2.0207001246374983,-0.7814139356401612,7,,Chardonnay apricot jam flavors simple sweet
0,-1.723800312025465,-0.11754053297681542,7,,oak sweet fruit unbalanced Chardonnay LifeSaver lemon candies baked Alaska dessert
0,1.2451978140948687,0.7559771021065341,17,,firm muscular powerful concentrated red currant cherry berry fruit young compact complexity herb leaf barrel spice good weight exceptional length precision
0,-0.5362010615773315,-0.32718476539681934,5,,ripe blackberry cherry mocha sweet dusty tannins polished gentle Cab sweet finish oaky drink now
0,1.2451978140948687,2.3283088452565632,5,,Cabernet dry richly flavored blackberries black currants cedar intense tannins youthful immaturity bottle complexity age
1,-1.723800312025465,-0.5018882924134892,2,,bizarrely perfumed candy shop fruit jelly tannins taut doesn't hang together
0,-1.4269004994134318,-0.46694758701015526,44,,wine in a box simple direct pineapple lime peach sugary sweet crisp clean acidity four regular bottles
0,0.651398188870802,-0.6067104086234912,20,,Muscat Canelli Muscat Giallo fragrant inviting slightly sweet honeysuckle citrus crisp texture lightness lingering acidity moderate-alcohol
0,0.057598563646735254,0.057162994039854496,37,,Aged American oak spice fruit Cherry berry flavors sturdy solid well-made 170 cases produced
1,1.5420976267069022,1.24514697775321,7,1.0,Burgundy Les Charmes mineral character Chablis Meursault richness vanilla flavors hold ready in a year
0,-2.3175999372495317,-0.3970661762034873,39,,porty dull undrinkable berry currant flavors
2,-0.23930124896529814,-0.36212547080015334,20,,ripe peaches anise almond plump mouthfeel flavors palate short finish apéritif mildly flavored fish poultry
2,1.2451978140948687,0.7559771021065341,27,,Cabernet Sauvignon Alicante Petit Verdot soapy herbal nose root beer exotic spice lavender potpourri green pepper corn well balanced
0,0.651398188870802,0.7559771021065341,28,,very dry fairly tannic black cherry cola leather oak black pepper complex decanting Mourvèdre Grenache Syrah Counoise
3,-0.5362010615773315,-0.6416511140268252,7,,waxy nose buttercup creamy yellow-fruit white flowers palate wet racy soda sweet candied peach melon acidity core sweetness
3,0.3544983762587686,-0.6416511140268252,27,,rustic leathery smoke leafiness earth baked berry spice density mouthfeel flavors chocolaty sweet acidity balance
0,0.057598563646735254,-0.7464732302368271,35,,dry minerally Sauvignon Blanc crisp acidity lemons grapefruits limes pineapples figs honeysuckle
0,-0.23930124896529814,0.16198511024985646,5,,firm astringent dry ripe flavors blackberries currants black cherries cedar solid Cabernet raw edges age
0,1.8389974393189357,0.3017479318631924,25,,earth kir fresh raspberry stellar wine appellation estate-grown four-acre spot trio of clones spirited refreshing dances in acidity floral back note cinnamon mocha
0,-1.4269004994134318,-0.32718476539681934,43,,Viognier tropical fruit wildflower vanilla spicy aromas thoroughly dry brightness zest flat
2,0.057598563646735254,-0.32718476539681934,20,2.0,smokey tones charcoal dark granite slate dusty mineral notes dark ripe fruit long-lasting penetrating
0,-0.23930124896529814,-0.25730335459015136,45,,tough aggressive tannins blackberry flavors hung meat smoky leather dimension soften years
2,0.9482980014828354,0.23186652105652442,27,2.0,Nero d'Avola Frappato terracotta amphorae bright fruit wild berries earth spice complexity
2,0.057598563646735254,-0.11754053297681542,7,2.0,oak-aged Chardonnay northern Italy bright intensity peach melon yellow flower elegance toast roasted nut creamy soft bitter almond
0,0.057598563646735254,-0.7115325248334932,5,0.0,rustic Dry Creek tannins briary blackberries cherries dry well-made elegant
0,0.651398188870802,-0.1874219437834834,7,,Oaky ripe tropical pineapple kumquat mineral floral smoke vanilla char flavorful acidic elegant Chard lingering spicy finish
3,-0.23930124896529814,-0.6765918194301591,39,,smooth ripe clean berry aromas cherry plum pepper tangy zippy clampy fresh pure common appeal
0,0.057598563646735254,0.5812735750898642,32,0.0,Sangiovese Candy Mountain Vineyard tight tart dark black cherry black licorice smoke tannins acids
0,-0.5362010615773315,-0.6067104086234912,32,,silky Pinot Noir soft Merlot gentle fruity berry tobacco cola spice tannins rich oily meats cheeses
0,-0.23930124896529814,-0.5368289978168233,17,,cherry fruit earthy base everyday Merlot herbal component light fruit
0,-1.4269004994134318,-0.25730335459015136,17,,date tar funky sweat-like aroma palate lax thin flavor firm tannins upper-lip-grabbing finish
1,0.057598563646735254,-0.32718476539681934,2,,tannic tough fruit black currant full rich perfumed wait until 2018
0,0.3544983762587686,-0.6067104086234912,30,,crisp refreshing grated ginger white flowers cantaloupe dry Riesling peachy fruit flavors steely backbone slate lime tart acidity pleasantly long finish lovely
0,-1.723800312025465,-0.8512953464468291,17,0.0,light generic low-priced Merlot California Washington new label beef
0,-1.1300006868013983,-0.3970661762034873,25,,blueberry blackberry fruity forward Pinot Noir savory herbs elegance one-dimensional palate big coarse tannins
0,-0.833100874189365,-0.5018882924134892,24,,crisp mouthwatering acidity lemons limes figs vanilla everyday wine roast chicken cocktail sipper
1,-0.833100874189365,-0.6765918194301591,2,,tobacco fresh raspberry light perfumed smoky fragrant Cabernet Franc blueberry tannins intense burst finishing acidity
0,0.651398188870802,-0.22236264918681736,37,0.0,Chelan region AVA Syrah aromatic flavorful ripe berries plums cherries smoke rock iron filings citrusy acids resin tar nuances
1,0.9482980014828354,0.7559771021065341,25,,well structured balanced tannins acidity sweet plums hints of coffee vanilla spice texture aging juicy character
0,-0.5362010615773315,-0.25730335459015136,37,,jammy blackberries cherries sweet caramelized oak yummy not especially complex drink now
0,-1.723800312025465,-0.1524812383801494,17,,thick soft simple sweetish medicinal flavors cherry black raspberry Lifesavers oak vanilla
0,-0.5362010615773315,-0.32718476539681934,37,0.0,ripeness blessing challenge super-fruit jammy blackberries blueberries currants cherries acidity complexity drink now
2,0.057598563646735254,-0.46694758701015526,9,,lush concentration deep aromas dark fruit black cherry excellent first impression Dolcetto dark color chewy texture inky texture
0,1.2451978140948687,1.280087683156544,7,0.0,Chardonnay dusty herbal Napa rich pineapple pie peach tart creamy lees buttery new oak Drink now–2012
2,-0.833100874189365,-0.6765918194301591,23,,lightweight thin zesty refreshing quenches thirst easy informal simplicity
1,1.2451978140948687,0.057162994039854496,35,,old vines superconcentrated ripe wine notes of toast spice yellow fruit bright acidity structure depth of flavor density age well 3–4 years
0,-0.5362010615773315,-0.04765912217014746,27,,Syrah Cabernet Franc Merlot Malbec Petite Sirah funky sour blackberry charcoal dried meat charred blueberry sour black plum savory meat
0,-1.1300006868013983,-0.5368289978168233,7,0.0,zippy fresh fruit spice aromas clean fruit flavors minerality complexity austere beguiling spice
0,-0.23930124896529814,0.5113921642831963,2,,soft sweetly fruity pie-filling flavors blackberries plums cherries anise cinnamon easy to like drink now
0,1.2451978140948687,2.1536053182398933,28,0.0,Rhône-style Saxum Paso Robles Syrah Grenache milk chocolate blackberry jam smoky oak high alcohol sensuous pleasures
0,-0.5362010615773315,-0.46694758701015526,5,,soft overripe currant licorice cherry cocoa oak dry tannins fresh grilled steak
